12:26:10.440106 IP 10.0.2.15.36418 > 216.58.214.4.443: UDP, length 160
12:26:10.534286 IP 216.58.214.4.443 > 10.0.2.15.36418: UDP, length 230
12:26:10.538397 IP 216.58.214.4.443 > 10.0.2.15.36418: UDP, length 27
12:26:10.538843 IP 10.0.2.15.36418 > 216.58.214.4.443: UDP, length 33
12:26:10.539167 IP 216.58.214.4.443 > 10.0.2.15.36418: UDP, length 62
12:26:10.566953 IP 10.0.2.15.36418 > 216.58.214.4.443: UDP, length 33
12:26:11.395810 IP 10.0.2.15.41372 > 104.16.18.94.443: Flags [S], seq 1087089689, win 64240, options [mss 1460,sackOK,TS val 1077270275 ecr 0,nop,wscale 10], length 0
12:26:11.396065 IP 10.0.2.15.32856 > 104.27.164.201.443: Flags [S], seq 2207874631, win 64240, options [mss 1460,sackOK,TS val 3359790013 ecr 0,nop,wscale 10], length 0
12:26:11.396294 IP 10.0.2.15.45018 > 212.129.31.248.443: Flags [S], seq 2874628854, win 64240, options [mss 1460,sackOK,TS val 576772860 ecr 0,nop,wscale 10], length 0
12:26:11.397531 IP 10.0.2.15.50906 > 172.217.17.67.443: UDP, length 1350
12:26:11.493044 IP 104.27.164.201.443 > 10.0.2.15.32856: Flags [S.], seq 607808001, ack 2207874632, win 65535, options [mss 1460], length 0
12:26:11.493231 IP 10.0.2.15.32856 > 104.27.164.201.443: Flags [.], ack 1, win 64240, length 0
12:26:11.494025 IP 10.0.2.15.32856 > 104.27.164.201.443: Flags [P.], seq 1:518, ack 1, win 64240, length 517
12:26:11.494817 IP 104.27.164.201.443 > 10.0.2.15.32856: Flags [.], ack 518, win 65535, length 0
12:26:11.495341 IP 212.129.31.248.443 > 10.0.2.15.45018: Flags [S.], seq 607872001, ack 2874628855, win 65535, options [mss 1460], length 0
12:26:11.495424 IP 10.0.2.15.45018 > 212.129.31.248.443: Flags [.], ack 1, win 64240, length 0
12:26:11.496086 IP 10.0.2.15.45018 > 212.129.31.248.443: Flags [P.], seq 1:518, ack 1, win 64240, length 517
12:26:11.497018 IP 212.129.31.248.443 > 10.0.2.15.45018: Flags [.], ack 518, win 65535, length 0
12:26:11.498129 IP 172.217.17.67.443 > 10.0.2.15.50906: UDP, length 1350
12:26:11.500040 IP 172.217.17.67.443 > 10.0.2.15.50906: UDP, length 1350
12:26:11.501502 IP 10.0.2.15.50906 > 172.217.17.67.443: UDP, length 42
12:26:11.504988 IP 104.16.18.94.443 > 10.0.2.15.41372: Flags [S.], seq 607936001, ack 1087089690, win 65535, options [mss 1460], length 0
12:26:11.505050 IP 10.0.2.15.41372 > 104.16.18.94.443: Flags [.], ack 1, win 64240, length 0
12:26:11.512344 IP 10.0.2.15.50906 > 172.217.17.67.443: UDP, length 1350
12:26:11.513127 IP 10.0.2.15.41372 > 104.16.18.94.443: Flags [P.], seq 1:518, ack 1, win 64240, length 517
12:26:11.513961 IP 104.16.18.94.443 > 10.0.2.15.41372: Flags [.], ack 518, win 65535, length 0
12:26:11.525006 IP 10.0.2.15.40718 > 93.158.134.90.443: Flags [S], seq 314729188, win 64240, options [mss 1460,sackOK,TS val 3125229616 ecr 0,nop,wscale 10], length 0
12:26:11.525335 IP 10.0.2.15.56332 > 178.154.131.215.443: Flags [S], seq 2298018340, win 64240, options [mss 1460,sackOK,TS val 3678918422 ecr 0,nop,wscale 10], length 0
12:26:11.589382 IP 104.27.164.201.443 > 10.0.2.15.32856: Flags [P.], seq 1:1821, ack 518, win 65535, length 1820
12:26:11.589490 IP 10.0.2.15.32856 > 104.27.164.201.443: Flags [.], ack 1821, win 62480, length 0
12:26:11.595161 IP 10.0.2.15.32856 > 104.27.164.201.443: Flags [P.], seq 518:582, ack 1821, win 63900, length 64
12:26:11.595863 IP 104.27.164.201.443 > 10.0.2.15.32856: Flags [.], ack 582, win 65535, length 0
12:26:11.596216 IP 212.129.31.248.443 > 10.0.2.15.45018: Flags [P.], seq 1:1441, ack 518, win 65535, length 1440
12:26:11.596233 IP 10.0.2.15.45018 > 212.129.31.248.443: Flags [.], ack 1441, win 63900, length 0
12:26:11.597441 IP 212.129.31.248.443 > 10.0.2.15.45018: Flags [P.], seq 1441:2881, ack 518, win 65535, length 1440
12:26:11.597551 IP 10.0.2.15.45018 > 212.129.31.248.443: Flags [.], ack 2881, win 63900, length 0
12:26:11.600087 IP 212.129.31.248.443 > 10.0.2.15.45018: Flags [P.], seq 2881:2956, ack 518, win 65535, length 75
12:26:11.600157 IP 10.0.2.15.45018 > 212.129.31.248.443: Flags [.], ack 2956, win 63900, length 0
12:26:11.600980 IP 10.0.2.15.45018 > 212.129.31.248.443: Flags [P.], seq 518:611, ack 2956, win 63900, length 93
12:26:11.601211 IP 10.0.2.15.45018 > 212.129.31.248.443: Flags [P.], seq 611:710, ack 2956, win 63900, length 99
12:26:11.601384 IP 212.129.31.248.443 > 10.0.2.15.45018: Flags [.], ack 611, win 65535, length 0
12:26:11.601400 IP 212.129.31.248.443 > 10.0.2.15.45018: Flags [.], ack 710, win 65535, length 0
12:26:11.601571 IP 10.0.2.15.45018 > 212.129.31.248.443: Flags [P.], seq 710:1265, ack 2956, win 63900, length 555
12:26:11.601952 IP 212.129.31.248.443 > 10.0.2.15.45018: Flags [.], ack 1265, win 65535, length 0
12:26:11.607185 IP 172.217.17.67.443 > 10.0.2.15.50906: UDP, length 1350
12:26:11.609938 IP 10.0.2.15.50906 > 172.217.17.67.443: UDP, length 33
12:26:11.639041 IP 104.16.18.94.443 > 10.0.2.15.41372: Flags [P.], seq 1:1441, ack 518, win 65535, length 1440
12:26:11.639087 IP 10.0.2.15.41372 > 104.16.18.94.443: Flags [.], ack 1441, win 63900, length 0
12:26:11.640164 IP 104.16.18.94.443 > 10.0.2.15.41372: Flags [P.], seq 1441:1992, ack 518, win 65535, length 551
12:26:11.640178 IP 10.0.2.15.41372 > 104.16.18.94.443: Flags [.], ack 1992, win 63349, length 0
12:26:11.649354 IP 10.0.2.15.41372 > 104.16.18.94.443: Flags [P.], seq 518:582, ack 1992, win 63349, length 64
12:26:11.650047 IP 104.16.18.94.443 > 10.0.2.15.41372: Flags [.], ack 582, win 65535, length 0
12:26:11.655872 IP 178.154.131.215.443 > 10.0.2.15.56332: Flags [S.], seq 608064001, ack 2298018341, win 65535, options [mss 1460], length 0
12:26:11.656049 IP 10.0.2.15.56332 > 178.154.131.215.443: Flags [.], ack 1, win 64240, length 0
12:26:11.656646 IP 10.0.2.15.56332 > 178.154.131.215.443: Flags [P.], seq 1:518, ack 1, win 64240, length 517
12:26:11.657169 IP 178.154.131.215.443 > 10.0.2.15.56332: Flags [.], ack 518, win 65535, length 0
12:26:11.658362 IP 93.158.134.90.443 > 10.0.2.15.40718: Flags [S.], seq 608128001, ack 314729189, win 65535, options [mss 1460], length 0
12:26:11.658428 IP 10.0.2.15.40718 > 93.158.134.90.443: Flags [.], ack 1, win 64240, length 0
12:26:11.658944 IP 10.0.2.15.40718 > 93.158.134.90.443: Flags [P.], seq 1:518, ack 1, win 64240, length 517
12:26:11.660489 IP 93.158.134.90.443 > 10.0.2.15.40718: Flags [.], ack 518, win 65535, length 0
12:26:11.681268 IP 104.27.164.201.443 > 10.0.2.15.32856: Flags [P.], seq 1821:2333, ack 582, win 65535, length 512
12:26:11.681316 IP 10.0.2.15.32856 > 104.27.164.201.443: Flags [.], ack 2333, win 63900, length 0
12:26:11.688164 IP 212.129.31.248.443 > 10.0.2.15.45018: Flags [P.], seq 2956:3214, ack 1265, win 65535, length 258
12:26:11.688217 IP 10.0.2.15.45018 > 212.129.31.248.443: Flags [.], ack 3214, win 63900, length 0
12:26:11.689239 IP 212.129.31.248.443 > 10.0.2.15.45018: Flags [P.], seq 3214:3321, ack 1265, win 65535, length 107
12:26:11.689256 IP 10.0.2.15.45018 > 212.129.31.248.443: Flags [.], ack 3321, win 63900, length 0
12:26:11.689424 IP 10.0.2.15.45018 > 212.129.31.248.443: Flags [P.], seq 1265:1303, ack 3321, win 63900, length 38
12:26:11.689918 IP 212.129.31.248.443 > 10.0.2.15.45018: Flags [.], ack 1303, win 65535, length 0
12:26:11.701777 IP 212.129.31.248.443 > 10.0.2.15.45018: Flags [P.], seq 3321:4761, ack 1303, win 65535, length 1440
12:26:11.701829 IP 10.0.2.15.45018 > 212.129.31.248.443: Flags [.], ack 4761, win 63900, length 0
12:26:11.703539 IP 212.129.31.248.443 > 10.0.2.15.45018: Flags [P.], seq 4761:6201, ack 1303, win 65535, length 1440
12:26:11.703563 IP 10.0.2.15.45018 > 212.129.31.248.443: Flags [.], ack 6201, win 62480, length 0
12:26:11.705592 IP 212.129.31.248.443 > 10.0.2.15.45018: Flags [P.], seq 6201:7641, ack 1303, win 65535, length 1440
12:26:11.705646 IP 10.0.2.15.45018 > 212.129.31.248.443: Flags [.], ack 7641, win 61060, length 0
12:26:11.711459 IP 212.129.31.248.443 > 10.0.2.15.45018: Flags [P.], seq 7641:9081, ack 1303, win 65535, length 1440
12:26:11.711533 IP 10.0.2.15.45018 > 212.129.31.248.443: Flags [.], ack 9081, win 63900, length 0
12:26:11.716384 IP 212.129.31.248.443 > 10.0.2.15.45018: Flags [P.], seq 9081:10521, ack 1303, win 65535, length 1440
12:26:11.716453 IP 10.0.2.15.45018 > 212.129.31.248.443: Flags [.], ack 10521, win 63900, length 0
12:26:11.724319 IP 212.129.31.248.443 > 10.0.2.15.45018: Flags [P.], seq 10521:11961, ack 1303, win 65535, length 1440
12:26:11.724404 IP 10.0.2.15.45018 > 212.129.31.248.443: Flags [.], ack 11961, win 63900, length 0
12:26:11.728244 IP 212.129.31.248.443 > 10.0.2.15.45018: Flags [P.], seq 11961:13401, ack 1303, win 65535, length 1440
12:26:11.728292 IP 10.0.2.15.45018 > 212.129.31.248.443: Flags [.], ack 13401, win 63900, length 0
12:26:11.750412 IP 104.16.18.94.443 > 10.0.2.15.41372: Flags [P.], seq 1992:2520, ack 582, win 65535, length 528
12:26:11.750537 IP 10.0.2.15.41372 > 104.16.18.94.443: Flags [.], ack 2520, win 63349, length 0
12:26:11.776894 IP 212.129.31.248.443 > 10.0.2.15.45018: Flags [P.], seq 13401:14841, ack 1303, win 65535, length 1440
12:26:11.776946 IP 10.0.2.15.45018 > 212.129.31.248.443: Flags [.], ack 14841, win 63900, length 0
12:26:11.778185 IP 212.129.31.248.443 > 10.0.2.15.45018: Flags [P.], seq 14841:16281, ack 1303, win 65535, length 1440
12:26:11.778209 IP 10.0.2.15.45018 > 212.129.31.248.443: Flags [.], ack 16281, win 63900, length 0
12:26:11.780352 IP 212.129.31.248.443 > 10.0.2.15.45018: Flags [P.], seq 16281:17721, ack 1303, win 65535, length 1440
12:26:11.780374 IP 10.0.2.15.45018 > 212.129.31.248.443: Flags [.], ack 17721, win 63900, length 0
12:26:11.786738 IP 212.129.31.248.443 > 10.0.2.15.45018: Flags [P.], seq 17721:19161, ack 1303, win 65535, length 1440
12:26:11.786783 IP 10.0.2.15.45018 > 212.129.31.248.443: Flags [.], ack 19161, win 63900, length 0
12:26:11.791826 IP 212.129.31.248.443 > 10.0.2.15.45018: Flags [P.], seq 19161:20601, ack 1303, win 65535, length 1440
12:26:11.793034 IP 10.0.2.15.45018 > 212.129.31.248.443: Flags [.], ack 20601, win 63900, length 0
12:26:11.799527 IP 178.154.131.215.443 > 10.0.2.15.56332: Flags [P.], seq 1:1411, ack 518, win 65535, length 1410
12:26:11.799657 IP 10.0.2.15.56332 > 178.154.131.215.443: Flags [.], ack 1411, win 63450, length 0
12:26:11.804262 IP 178.154.131.215.443 > 10.0.2.15.56332: Flags [P.], seq 1411:2821, ack 518, win 65535, length 1410
12:26:11.804302 IP 10.0.2.15.56332 > 178.154.131.215.443: Flags [.], ack 2821, win 63450, length 0
12:26:11.813936 IP 178.154.131.215.443 > 10.0.2.15.56332: Flags [P.], seq 2821:4231, ack 518, win 65535, length 1410
12:26:11.814022 IP 10.0.2.15.56332 > 178.154.131.215.443: Flags [.], ack 4231, win 63450, length 0
12:26:11.816824 IP 212.129.31.248.443 > 10.0.2.15.45018: Flags [P.], seq 20601:22041, ack 1303, win 65535, length 1440
12:26:11.816901 IP 10.0.2.15.45018 > 212.129.31.248.443: Flags [.], ack 22041, win 63900, length 0
12:26:11.825008 IP 93.158.134.90.443 > 10.0.2.15.40718: Flags [P.], seq 1:1411, ack 518, win 65535, length 1410
12:26:11.825068 IP 10.0.2.15.40718 > 93.158.134.90.443: Flags [.], ack 1411, win 63450, length 0
12:26:11.828344 IP 93.158.134.90.443 > 10.0.2.15.40718: Flags [P.], seq 1411:2821, ack 518, win 65535, length 1410
12:26:11.828429 IP 10.0.2.15.40718 > 93.158.134.90.443: Flags [.], ack 2821, win 63450, length 0
12:26:11.836514 IP 93.158.134.90.443 > 10.0.2.15.40718: Flags [P.], seq 2821:4231, ack 518, win 65535, length 1410
12:26:11.836561 IP 10.0.2.15.40718 > 93.158.134.90.443: Flags [.], ack 4231, win 63450, length 0
12:26:11.840544 IP 93.158.134.90.443 > 10.0.2.15.40718: Flags [P.], seq 4231:4551, ack 518, win 65535, length 320
12:26:11.840645 IP 10.0.2.15.40718 > 93.158.134.90.443: Flags [.], ack 4551, win 63450, length 0
12:26:11.842757 IP 178.154.131.215.443 > 10.0.2.15.56332: Flags [P.], seq 4231:4674, ack 518, win 65535, length 443
12:26:11.842867 IP 10.0.2.15.56332 > 178.154.131.215.443: Flags [.], ack 4674, win 63450, length 0
12:26:11.844549 IP 212.129.31.248.443 > 10.0.2.15.45018: Flags [P.], seq 22041:23481, ack 1303, win 65535, length 1440
12:26:11.844579 IP 10.0.2.15.45018 > 212.129.31.248.443: Flags [.], ack 23481, win 63900, length 0
12:26:11.848551 IP 212.129.31.248.443 > 10.0.2.15.45018: Flags [P.], seq 23481:24921, ack 1303, win 65535, length 1440
12:26:11.848619 IP 10.0.2.15.45018 > 212.129.31.248.443: Flags [.], ack 24921, win 63900, length 0
12:26:11.851381 IP 10.0.2.15.40718 > 93.158.134.90.443: Flags [P.], seq 518:644, ack 4551, win 63450, length 126
12:26:11.852858 IP 93.158.134.90.443 > 10.0.2.15.40718: Flags [.], ack 644, win 65535, length 0
12:26:11.852998 IP 10.0.2.15.56332 > 178.154.131.215.443: Flags [P.], seq 518:598, ack 4674, win 63450, length 80
12:26:11.854017 IP 178.154.131.215.443 > 10.0.2.15.56332: Flags [.], ack 598, win 65535, length 0
12:26:11.856083 IP 212.129.31.248.443 > 10.0.2.15.45018: Flags [P.], seq 24921:26361, ack 1303, win 65535, length 1440
12:26:11.856134 IP 10.0.2.15.45018 > 212.129.31.248.443: Flags [.], ack 26361, win 63900, length 0
12:26:11.860088 IP 212.129.31.248.443 > 10.0.2.15.45018: Flags [P.], seq 26361:27801, ack 1303, win 65535, length 1440
12:26:11.860122 IP 10.0.2.15.45018 > 212.129.31.248.443: Flags [.], ack 27801, win 63900, length 0
12:26:11.868965 IP 212.129.31.248.443 > 10.0.2.15.45018: Flags [P.], seq 27801:29053, ack 1303, win 65535, length 1252
12:26:11.869153 IP 10.0.2.15.45018 > 212.129.31.248.443: Flags [.], ack 29053, win 63900, length 0
12:26:11.977373 IP 93.158.134.90.443 > 10.0.2.15.40718: Flags [P.], seq 4551:4809, ack 644, win 65535, length 258
12:26:11.977420 IP 10.0.2.15.40718 > 93.158.134.90.443: Flags [.], ack 4809, win 63450, length 0
12:26:11.977951 IP 178.154.131.215.443 > 10.0.2.15.56332: Flags [P.], seq 4674:4969, ack 598, win 65535, length 295
12:26:11.977963 IP 10.0.2.15.56332 > 178.154.131.215.443: Flags [.], ack 4969, win 63450, length 0
12:26:11.977998 IP 93.158.134.90.443 > 10.0.2.15.40718: Flags [P.], seq 4809:4878, ack 644, win 65535, length 69
12:26:11.978005 IP 10.0.2.15.40718 > 93.158.134.90.443: Flags [.], ack 4878, win 63450, length 0
12:26:11.979906 IP 178.154.131.215.443 > 10.0.2.15.56332: Flags [P.], seq 4969:5326, ack 598, win 65535, length 357
12:26:11.980017 IP 10.0.2.15.56332 > 178.154.131.215.443: Flags [.], ack 5326, win 63450, length 0
12:26:12.009320 IP 10.0.2.15.41566 > 79.171.117.17.443: Flags [S], seq 5492423, win 64240, options [mss 1460,sackOK,TS val 2014921870 ecr 0,nop,wscale 10], length 0
12:26:12.021549 IP 10.0.2.15.54258 > 88.212.201.82.443: Flags [S], seq 1598568730, win 64240, options [mss 1460,sackOK,TS val 2221405145 ecr 0,nop,wscale 10], length 0
12:26:12.087846 IP 79.171.117.17.443 > 10.0.2.15.41566: Flags [S.], seq 608256001, ack 5492424, win 65535, options [mss 1460], length 0
12:26:12.087955 IP 10.0.2.15.41566 > 79.171.117.17.443: Flags [.], ack 1, win 64240, length 0
12:26:12.096816 IP 10.0.2.15.41566 > 79.171.117.17.443: Flags [P.], seq 1:518, ack 1, win 64240, length 517
12:26:12.099322 IP 79.171.117.17.443 > 10.0.2.15.41566: Flags [.], ack 518, win 65535, length 0
12:26:12.130549 IP 10.0.2.15.55180 > 93.158.134.118.443: Flags [S], seq 2632424364, win 64240, options [mss 1460,sackOK,TS val 379458084 ecr 0,nop,wscale 10], length 0
12:26:12.131024 IP 10.0.2.15.54770 > 62.76.25.28.443: Flags [S], seq 904398832, win 64240, options [mss 1460,sackOK,TS val 3330039154 ecr 0,nop,wscale 10], length 0
12:26:12.131121 IP 10.0.2.15.54772 > 62.76.25.28.443: Flags [S], seq 1271892960, win 64240, options [mss 1460,sackOK,TS val 3330039154 ecr 0,nop,wscale 10], length 0
12:26:12.131392 IP 10.0.2.15.49174 > 54.228.203.167.443: Flags [S], seq 3111135389, win 64240, options [mss 1460,sackOK,TS val 1319730610 ecr 0,nop,wscale 10], length 0
12:26:12.136745 IP 10.0.2.15.52332 > 77.88.21.179.443: Flags [S], seq 4129084771, win 64240, options [mss 1460,sackOK,TS val 1281393893 ecr 0,nop,wscale 10], length 0
12:26:12.143867 IP 88.212.201.82.443 > 10.0.2.15.54258: Flags [S.], seq 608320001, ack 1598568731, win 65535, options [mss 1460], length 0
12:26:12.143959 IP 10.0.2.15.54258 > 88.212.201.82.443: Flags [.], ack 1, win 64240, length 0
12:26:12.146184 IP 10.0.2.15.54258 > 88.212.201.82.443: Flags [P.], seq 1:518, ack 1, win 64240, length 517
12:26:12.147716 IP 88.212.201.82.443 > 10.0.2.15.54258: Flags [.], ack 518, win 65535, length 0
12:26:12.154025 IP 10.0.2.15.33128 > 87.250.251.119.443: Flags [S], seq 1608199779, win 64240, options [mss 1460,sackOK,TS val 1504759235 ecr 0,nop,wscale 10], length 0
12:26:12.155752 IP 10.0.2.15.45018 > 212.129.31.248.443: Flags [P.], seq 1303:1478, ack 29053, win 63900, length 175
12:26:12.156155 IP 212.129.31.248.443 > 10.0.2.15.45018: Flags [.], ack 1478, win 65535, length 0
12:26:12.179498 IP 79.171.117.17.443 > 10.0.2.15.41566: Flags [P.], seq 1:100, ack 518, win 65535, length 99
12:26:12.179535 IP 10.0.2.15.41566 > 79.171.117.17.443: Flags [.], ack 100, win 64141, length 0
12:26:12.180798 IP 10.0.2.15.41566 > 79.171.117.17.443: Flags [P.], seq 518:1041, ack 100, win 64141, length 523
12:26:12.181316 IP 79.171.117.17.443 > 10.0.2.15.41566: Flags [.], ack 1041, win 65535, length 0
12:26:12.233837 IP 54.228.203.167.443 > 10.0.2.15.49174: Flags [S.], seq 608384001, ack 3111135390, win 65535, options [mss 1460], length 0
12:26:12.233947 IP 10.0.2.15.49174 > 54.228.203.167.443: Flags [.], ack 1, win 64240, length 0
12:26:12.247317 IP 10.0.2.15.49174 > 54.228.203.167.443: Flags [P.], seq 1:518, ack 1, win 64240, length 517
12:26:12.248155 IP 54.228.203.167.443 > 10.0.2.15.49174: Flags [.], ack 518, win 65535, length 0
12:26:12.252698 IP 62.76.25.28.443 > 10.0.2.15.54772: Flags [S.], seq 608448001, ack 1271892961, win 65535, options [mss 1460], length 0
12:26:12.252820 IP 10.0.2.15.54772 > 62.76.25.28.443: Flags [.], ack 1, win 64240, length 0
12:26:12.253447 IP 10.0.2.15.54772 > 62.76.25.28.443: Flags [P.], seq 1:518, ack 1, win 64240, length 517
12:26:12.254284 IP 62.76.25.28.443 > 10.0.2.15.54772: Flags [.], ack 518, win 65535, length 0
12:26:12.254761 IP 212.129.31.248.443 > 10.0.2.15.45018: Flags [P.], seq 29053:30493, ack 1478, win 65535, length 1440
12:26:12.254780 IP 10.0.2.15.45018 > 212.129.31.248.443: Flags [.], ack 30493, win 63900, length 0
12:26:12.257753 IP 212.129.31.248.443 > 10.0.2.15.45018: Flags [P.], seq 30493:31933, ack 1478, win 65535, length 1440
12:26:12.257799 IP 10.0.2.15.45018 > 212.129.31.248.443: Flags [.], ack 31933, win 63900, length 0
12:26:12.258853 IP 212.129.31.248.443 > 10.0.2.15.45018: Flags [P.], seq 31933:33373, ack 1478, win 65535, length 1440
12:26:12.258888 IP 10.0.2.15.45018 > 212.129.31.248.443: Flags [.], ack 33373, win 63900, length 0
12:26:12.262828 IP 212.129.31.248.443 > 10.0.2.15.45018: Flags [P.], seq 33373:34813, ack 1478, win 65535, length 1440
12:26:12.262912 IP 10.0.2.15.45018 > 212.129.31.248.443: Flags [.], ack 34813, win 63900, length 0
12:26:12.266373 IP 10.0.2.15.55196 > 93.158.134.118.443: Flags [S], seq 2441939544, win 64240, options [mss 1460,sackOK,TS val 379458219 ecr 0,nop,wscale 10], length 0
12:26:12.270667 IP 212.129.31.248.443 > 10.0.2.15.45018: Flags [P.], seq 34813:36253, ack 1478, win 65535, length 1440
12:26:12.270739 IP 10.0.2.15.45018 > 212.129.31.248.443: Flags [.], ack 36253, win 63900, length 0
12:26:12.276011 IP 212.129.31.248.443 > 10.0.2.15.45018: Flags [P.], seq 36253:37693, ack 1478, win 65535, length 1440
12:26:12.276045 IP 10.0.2.15.45018 > 212.129.31.248.443: Flags [.], ack 37693, win 63900, length 0
12:26:12.276826 IP 10.0.2.15.54790 > 62.76.25.28.443: Flags [S], seq 3723406548, win 64240, options [mss 1460,sackOK,TS val 3330039300 ecr 0,nop,wscale 10], length 0
12:26:12.283410 IP 212.129.31.248.443 > 10.0.2.15.45018: Flags [P.], seq 37693:39133, ack 1478, win 65535, length 1440
12:26:12.283466 IP 10.0.2.15.45018 > 212.129.31.248.443: Flags [.], ack 39133, win 63900, length 0
12:26:12.288008 IP 212.129.31.248.443 > 10.0.2.15.45018: Flags [P.], seq 39133:40573, ack 1478, win 65535, length 1440
12:26:12.288076 IP 10.0.2.15.45018 > 212.129.31.248.443: Flags [.], ack 40573, win 63900, length 0
12:26:12.294607 IP 62.76.25.28.443 > 10.0.2.15.54770: Flags [S.], seq 608512001, ack 904398833, win 65535, options [mss 1460], length 0
12:26:12.294742 IP 10.0.2.15.54770 > 62.76.25.28.443: Flags [.], ack 1, win 64240, length 0
12:26:12.294776 IP 93.158.134.118.443 > 10.0.2.15.55180: Flags [S.], seq 608576001, ack 2632424365, win 65535, options [mss 1460], length 0
12:26:12.294805 IP 10.0.2.15.55180 > 93.158.134.118.443: Flags [.], ack 1, win 64240, length 0
12:26:12.295995 IP 87.250.251.119.443 > 10.0.2.15.33128: Flags [S.], seq 608640001, ack 1608199780, win 65535, options [mss 1460], length 0
12:26:12.296049 IP 10.0.2.15.33128 > 87.250.251.119.443: Flags [.], ack 1, win 64240, length 0
12:26:12.296080 IP 88.212.201.82.443 > 10.0.2.15.54258: Flags [P.], seq 1:1441, ack 518, win 65535, length 1440
12:26:12.296094 IP 10.0.2.15.54258 > 88.212.201.82.443: Flags [.], ack 1441, win 63900, length 0
12:26:12.297108 IP 10.0.2.15.54770 > 62.76.25.28.443: Flags [P.], seq 1:518, ack 1, win 64240, length 517
12:26:12.297506 IP 10.0.2.15.55180 > 93.158.134.118.443: Flags [P.], seq 1:518, ack 1, win 64240, length 517
12:26:12.297718 IP 10.0.2.15.33128 > 87.250.251.119.443: Flags [P.], seq 1:518, ack 1, win 64240, length 517
12:26:12.298471 IP 62.76.25.28.443 > 10.0.2.15.54770: Flags [.], ack 518, win 65535, length 0
12:26:12.298515 IP 93.158.134.118.443 > 10.0.2.15.55180: Flags [.], ack 518, win 65535, length 0
12:26:12.298812 IP 87.250.251.119.443 > 10.0.2.15.33128: Flags [.], ack 518, win 65535, length 0
12:26:12.300770 IP 88.212.201.82.443 > 10.0.2.15.54258: Flags [P.], seq 1441:2881, ack 518, win 65535, length 1440
12:26:12.300847 IP 10.0.2.15.54258 > 88.212.201.82.443: Flags [.], ack 2881, win 63900, length 0
12:26:12.308489 IP 212.129.31.248.443 > 10.0.2.15.45018: Flags [P.], seq 40573:42013, ack 1478, win 65535, length 1440
12:26:12.308541 IP 10.0.2.15.45018 > 212.129.31.248.443: Flags [.], ack 42013, win 63900, length 0
12:26:12.312475 IP 79.171.117.17.443 > 10.0.2.15.41566: Flags [P.], seq 100:1510, ack 1041, win 65535, length 1410
12:26:12.312501 IP 10.0.2.15.41566 > 79.171.117.17.443: Flags [.], ack 1510, win 63450, length 0
12:26:12.320995 IP 79.171.117.17.443 > 10.0.2.15.41566: Flags [P.], seq 1510:2920, ack 1041, win 65535, length 1410
12:26:12.321073 IP 10.0.2.15.41566 > 79.171.117.17.443: Flags [.], ack 2920, win 63450, length 0
12:26:12.324633 IP 79.171.117.17.443 > 10.0.2.15.41566: Flags [P.], seq 2920:3788, ack 1041, win 65535, length 868
12:26:12.324670 IP 10.0.2.15.41566 > 79.171.117.17.443: Flags [.], ack 3788, win 63450, length 0
12:26:12.328649 IP 77.88.21.179.443 > 10.0.2.15.52332: Flags [S.], seq 608704001, ack 4129084772, win 65535, options [mss 1460], length 0
12:26:12.328735 IP 10.0.2.15.52332 > 77.88.21.179.443: Flags [.], ack 1, win 64240, length 0
12:26:12.328753 IP 88.212.201.82.443 > 10.0.2.15.54258: Flags [P.], seq 2881:4321, ack 518, win 65535, length 1440
12:26:12.328763 IP 10.0.2.15.54258 > 88.212.201.82.443: Flags [.], ack 4321, win 63900, length 0
12:26:12.329076 IP 10.0.2.15.52332 > 77.88.21.179.443: Flags [P.], seq 1:518, ack 1, win 64240, length 517
12:26:12.329592 IP 77.88.21.179.443 > 10.0.2.15.52332: Flags [.], ack 518, win 65535, length 0
12:26:12.334932 IP 10.0.2.15.41566 > 79.171.117.17.443: Flags [P.], seq 1041:1115, ack 3788, win 63450, length 74
12:26:12.335392 IP 10.0.2.15.41566 > 79.171.117.17.443: Flags [P.], seq 1115:1597, ack 3788, win 63450, length 482
12:26:12.335928 IP 79.171.117.17.443 > 10.0.2.15.41566: Flags [.], ack 1115, win 65535, length 0
12:26:12.335974 IP 79.171.117.17.443 > 10.0.2.15.41566: Flags [.], ack 1597, win 65535, length 0
12:26:12.337328 IP 212.129.31.248.443 > 10.0.2.15.45018: Flags [P.], seq 42013:43453, ack 1478, win 65535, length 1440
12:26:12.337358 IP 10.0.2.15.45018 > 212.129.31.248.443: Flags [.], ack 43453, win 63900, length 0
12:26:12.340482 IP 88.212.201.82.443 > 10.0.2.15.54258: Flags [P.], seq 4321:5469, ack 518, win 65535, length 1148
12:26:12.340569 IP 10.0.2.15.54258 > 88.212.201.82.443: Flags [.], ack 5469, win 63900, length 0
12:26:12.344555 IP 212.129.31.248.443 > 10.0.2.15.45018: Flags [P.], seq 43453:44893, ack 1478, win 65535, length 1440
12:26:12.344654 IP 10.0.2.15.45018 > 212.129.31.248.443: Flags [.], ack 44893, win 63900, length 0
12:26:12.347288 IP 10.0.2.15.54258 > 88.212.201.82.443: Flags [P.], seq 518:644, ack 5469, win 63900, length 126
12:26:12.347757 IP 10.0.2.15.54258 > 88.212.201.82.443: Flags [P.], seq 644:743, ack 5469, win 63900, length 99
12:26:12.348332 IP 10.0.2.15.54258 > 88.212.201.82.443: Flags [P.], seq 743:1016, ack 5469, win 63900, length 273
12:26:12.348618 IP 88.212.201.82.443 > 10.0.2.15.54258: Flags [.], ack 644, win 65535, length 0
12:26:12.348647 IP 88.212.201.82.443 > 10.0.2.15.54258: Flags [.], ack 743, win 65535, length 0
12:26:12.352847 IP 88.212.201.82.443 > 10.0.2.15.54258: Flags [.], ack 1016, win 65535, length 0
12:26:12.352910 IP 212.129.31.248.443 > 10.0.2.15.45018: Flags [P.], seq 44893:46333, ack 1478, win 65535, length 1440
12:26:12.352945 IP 10.0.2.15.45018 > 212.129.31.248.443: Flags [.], ack 46333, win 63900, length 0
12:26:12.356145 IP 212.129.31.248.443 > 10.0.2.15.45018: Flags [P.], seq 46333:47773, ack 1478, win 65535, length 1440
12:26:12.356192 IP 10.0.2.15.45018 > 212.129.31.248.443: Flags [.], ack 47773, win 62480, length 0
12:26:12.364820 IP 54.228.203.167.443 > 10.0.2.15.49174: Flags [P.], seq 1:1441, ack 518, win 65535, length 1440
12:26:12.364860 IP 10.0.2.15.49174 > 54.228.203.167.443: Flags [.], ack 1441, win 63900, length 0
12:26:12.372134 IP 54.228.203.167.443 > 10.0.2.15.49174: Flags [P.], seq 1441:2881, ack 518, win 65535, length 1440
12:26:12.372209 IP 10.0.2.15.49174 > 54.228.203.167.443: Flags [.], ack 2881, win 63900, length 0
12:26:12.376540 IP 212.129.31.248.443 > 10.0.2.15.45018: Flags [P.], seq 47773:49213, ack 1478, win 65535, length 1440
12:26:12.376583 IP 10.0.2.15.45018 > 212.129.31.248.443: Flags [.], ack 49213, win 63900, length 0
12:26:12.380669 IP 54.228.203.167.443 > 10.0.2.15.49174: Flags [P.], seq 2881:4097, ack 518, win 65535, length 1216
12:26:12.380706 IP 10.0.2.15.49174 > 54.228.203.167.443: Flags [.], ack 4097, win 63900, length 0
12:26:12.388307 IP 62.76.25.28.443 > 10.0.2.15.54772: Flags [P.], seq 1:1441, ack 518, win 65535, length 1440
12:26:12.388349 IP 10.0.2.15.54772 > 62.76.25.28.443: Flags [.], ack 1441, win 63900, length 0
12:26:12.393289 IP 62.76.25.28.443 > 10.0.2.15.54772: Flags [P.], seq 1441:2881, ack 518, win 65535, length 1440
12:26:12.393356 IP 10.0.2.15.54772 > 62.76.25.28.443: Flags [.], ack 2881, win 63900, length 0
12:26:12.400386 IP 62.76.25.28.443 > 10.0.2.15.54772: Flags [P.], seq 2881:2951, ack 518, win 65535, length 70
12:26:12.400458 IP 10.0.2.15.54772 > 62.76.25.28.443: Flags [.], ack 2951, win 63900, length 0
12:26:12.403064 IP 62.76.25.28.443 > 10.0.2.15.54790: Flags [S.], seq 608768001, ack 3723406549, win 65535, options [mss 1460], length 0
12:26:12.403117 IP 10.0.2.15.54772 > 62.76.25.28.443: Flags [P.], seq 518:611, ack 2951, win 63900, length 93
12:26:12.403170 IP 212.129.31.248.443 > 10.0.2.15.45018: Flags [P.], seq 49213:50653, ack 1478, win 65535, length 1440
12:26:12.403194 IP 10.0.2.15.54790 > 62.76.25.28.443: Flags [.], ack 1, win 64240, length 0
12:26:12.403196 IP 10.0.2.15.45018 > 212.129.31.248.443: Flags [.], ack 50653, win 63900, length 0
12:26:12.403612 IP 62.76.25.28.443 > 10.0.2.15.54772: Flags [.], ack 611, win 65535, length 0
12:26:12.403945 IP 10.0.2.15.54790 > 62.76.25.28.443: Flags [P.], seq 1:518, ack 1, win 64240, length 517
12:26:12.404173 IP 10.0.2.15.54772 > 62.76.25.28.443: Flags [P.], seq 611:710, ack 2951, win 63900, length 99
12:26:12.404510 IP 62.76.25.28.443 > 10.0.2.15.54790: Flags [.], ack 518, win 65535, length 0
12:26:12.404543 IP 10.0.2.15.54772 > 62.76.25.28.443: Flags [P.], seq 710:983, ack 2951, win 63900, length 273
12:26:12.404646 IP 62.76.25.28.443 > 10.0.2.15.54772: Flags [.], ack 710, win 65535, length 0
12:26:12.405177 IP 62.76.25.28.443 > 10.0.2.15.54772: Flags [.], ack 983, win 65535, length 0
12:26:12.414601 IP 54.228.203.167.443 > 10.0.2.15.49174: Flags [P.], seq 4097:5288, ack 518, win 65535, length 1191
12:26:12.414683 IP 10.0.2.15.49174 > 54.228.203.167.443: Flags [.], ack 5288, win 63900, length 0
12:26:12.415807 IP 212.129.31.248.443 > 10.0.2.15.45018: Flags [P.], seq 50653:52093, ack 1478, win 65535, length 1440
12:26:12.415834 IP 10.0.2.15.45018 > 212.129.31.248.443: Flags [.], ack 52093, win 63900, length 0
12:26:12.417139 IP 93.158.134.118.443 > 10.0.2.15.55196: Flags [S.], seq 608832001, ack 2441939545, win 65535, options [mss 1460], length 0
12:26:12.417229 IP 10.0.2.15.55196 > 93.158.134.118.443: Flags [.], ack 1, win 64240, length 0
12:26:12.417252 IP 79.171.117.17.443 > 10.0.2.15.41566: Flags [P.], seq 3788:4075, ack 1597, win 65535, length 287
12:26:12.417265 IP 10.0.2.15.41566 > 79.171.117.17.443: Flags [.], ack 4075, win 63450, length 0
12:26:12.417739 IP 10.0.2.15.55196 > 93.158.134.118.443: Flags [P.], seq 1:518, ack 1, win 64240, length 517
12:26:12.418199 IP 93.158.134.118.443 > 10.0.2.15.55196: Flags [.], ack 518, win 65535, length 0
12:26:12.420415 IP 79.171.117.17.443 > 10.0.2.15.41566: Flags [P.], seq 4075:4362, ack 1597, win 65535, length 287
12:26:12.420468 IP 10.0.2.15.41566 > 79.171.117.17.443: Flags [.], ack 4362, win 63450, length 0
12:26:12.420489 IP 212.129.31.248.443 > 10.0.2.15.45018: Flags [P.], seq 52093:53533, ack 1478, win 65535, length 1440
12:26:12.420497 IP 10.0.2.15.45018 > 212.129.31.248.443: Flags [.], ack 53533, win 63900, length 0
12:26:12.426270 IP 212.129.31.248.443 > 10.0.2.15.45018: Flags [P.], seq 53533:54784, ack 1478, win 65535, length 1251
12:26:12.428549 IP 10.0.2.15.49174 > 54.228.203.167.443: Flags [P.], seq 518:644, ack 5288, win 63900, length 126
12:26:12.428932 IP 10.0.2.15.45018 > 212.129.31.248.443: Flags [.], ack 54784, win 63900, length 0
12:26:12.429141 IP 54.228.203.167.443 > 10.0.2.15.49174: Flags [.], ack 644, win 65535, length 0
12:26:12.431073 IP 79.171.117.17.443 > 10.0.2.15.41566: Flags [P.], seq 4362:5772, ack 1597, win 65535, length 1410
12:26:12.431147 IP 10.0.2.15.41566 > 79.171.117.17.443: Flags [.], ack 5772, win 63450, length 0
12:26:12.436255 IP 79.171.117.17.443 > 10.0.2.15.41566: Flags [P.], seq 5772:7182, ack 1597, win 65535, length 1410
12:26:12.436315 IP 10.0.2.15.41566 > 79.171.117.17.443: Flags [.], ack 7182, win 63450, length 0
12:26:12.442210 IP 79.171.117.17.443 > 10.0.2.15.41566: Flags [P.], seq 7182:8592, ack 1597, win 65535, length 1410
12:26:12.442258 IP 10.0.2.15.41566 > 79.171.117.17.443: Flags [.], ack 8592, win 63450, length 0
12:26:12.450683 IP 87.250.251.119.443 > 10.0.2.15.33128: Flags [P.], seq 1:1411, ack 518, win 65535, length 1410
12:26:12.450737 IP 10.0.2.15.33128 > 87.250.251.119.443: Flags [.], ack 1411, win 63450, length 0
12:26:12.456928 IP 87.250.251.119.443 > 10.0.2.15.33128: Flags [P.], seq 1411:2821, ack 518, win 65535, length 1410
12:26:12.456991 IP 10.0.2.15.33128 > 87.250.251.119.443: Flags [.], ack 2821, win 63450, length 0
12:26:12.460443 IP 79.171.117.17.443 > 10.0.2.15.41566: Flags [P.], seq 8592:10002, ack 1597, win 65535, length 1410
12:26:12.460470 IP 10.0.2.15.41566 > 79.171.117.17.443: Flags [.], ack 10002, win 63450, length 0
12:26:12.468408 IP 62.76.25.28.443 > 10.0.2.15.54770: Flags [P.], seq 1:1441, ack 518, win 65535, length 1440
12:26:12.468455 IP 10.0.2.15.54770 > 62.76.25.28.443: Flags [.], ack 1441, win 63900, length 0
12:26:12.472350 IP 62.76.25.28.443 > 10.0.2.15.54770: Flags [P.], seq 1441:2881, ack 518, win 65535, length 1440
12:26:12.472402 IP 10.0.2.15.54770 > 62.76.25.28.443: Flags [.], ack 2881, win 63900, length 0
12:26:12.480731 IP 62.76.25.28.443 > 10.0.2.15.54770: Flags [P.], seq 2881:2950, ack 518, win 65535, length 69
12:26:12.480808 IP 10.0.2.15.54770 > 62.76.25.28.443: Flags [.], ack 2950, win 63900, length 0
12:26:12.480879 IP 93.158.134.118.443 > 10.0.2.15.55180: Flags [P.], seq 1:1411, ack 518, win 65535, length 1410
12:26:12.480896 IP 10.0.2.15.55180 > 93.158.134.118.443: Flags [.], ack 1411, win 63450, length 0
12:26:12.482010 IP 10.0.2.15.54770 > 62.76.25.28.443: Flags [P.], seq 518:611, ack 2950, win 63900, length 93
12:26:12.482554 IP 10.0.2.15.54770 > 62.76.25.28.443: Flags [P.], seq 611:710, ack 2950, win 63900, length 99
12:26:12.482884 IP 62.76.25.28.443 > 10.0.2.15.54770: Flags [.], ack 611, win 65535, length 0
12:26:12.482916 IP 62.76.25.28.443 > 10.0.2.15.54770: Flags [.], ack 710, win 65535, length 0
12:26:12.483108 IP 10.0.2.15.54770 > 62.76.25.28.443: Flags [P.], seq 710:982, ack 2950, win 63900, length 272
12:26:12.483510 IP 62.76.25.28.443 > 10.0.2.15.54770: Flags [.], ack 982, win 65535, length 0
12:26:12.484939 IP 93.158.134.118.443 > 10.0.2.15.55180: Flags [P.], seq 1411:2821, ack 518, win 65535, length 1410
12:26:12.484968 IP 10.0.2.15.55180 > 93.158.134.118.443: Flags [.], ack 2821, win 63450, length 0
12:26:12.491996 IP 93.158.134.118.443 > 10.0.2.15.55180: Flags [P.], seq 2821:4231, ack 518, win 65535, length 1410
12:26:12.492044 IP 10.0.2.15.55180 > 93.158.134.118.443: Flags [.], ack 4231, win 63450, length 0
12:26:12.500060 IP 93.158.134.118.443 > 10.0.2.15.55180: Flags [P.], seq 4231:4523, ack 518, win 65535, length 292
12:26:12.500100 IP 10.0.2.15.55180 > 93.158.134.118.443: Flags [.], ack 4523, win 63450, length 0
12:26:12.500865 IP 10.0.2.15.55180 > 93.158.134.118.443: Flags [P.], seq 518:611, ack 4523, win 63450, length 93
12:26:12.501308 IP 87.250.251.119.443 > 10.0.2.15.33128: Flags [P.], seq 2821:4231, ack 518, win 65535, length 1410
12:26:12.501326 IP 10.0.2.15.33128 > 87.250.251.119.443: Flags [.], ack 4231, win 63450, length 0
12:26:12.501360 IP 10.0.2.15.55180 > 93.158.134.118.443: Flags [P.], seq 611:710, ack 4523, win 63450, length 99
12:26:12.501674 IP 93.158.134.118.443 > 10.0.2.15.55180: Flags [.], ack 611, win 65535, length 0
12:26:12.502015 IP 10.0.2.15.55180 > 93.158.134.118.443: Flags [P.], seq 710:1153, ack 4523, win 63450, length 443
12:26:12.502086 IP 93.158.134.118.443 > 10.0.2.15.55180: Flags [.], ack 710, win 65535, length 0
12:26:12.502372 IP 93.158.134.118.443 > 10.0.2.15.55180: Flags [.], ack 1153, win 65535, length 0
12:26:12.504243 IP 79.171.117.17.443 > 10.0.2.15.41566: Flags [P.], seq 10002:11412, ack 1597, win 65535, length 1410
12:26:12.504269 IP 10.0.2.15.41566 > 79.171.117.17.443: Flags [.], ack 11412, win 63450, length 0
12:26:12.512073 IP 88.212.201.82.443 > 10.0.2.15.54258: Flags [P.], seq 5469:5834, ack 1016, win 65535, length 365
12:26:12.512122 IP 10.0.2.15.54258 > 88.212.201.82.443: Flags [.], ack 5834, win 63900, length 0
12:26:12.512522 IP 10.0.2.15.54258 > 88.212.201.82.443: Flags [P.], seq 1016:1054, ack 5834, win 63900, length 38
12:26:12.512992 IP 88.212.201.82.443 > 10.0.2.15.54258: Flags [.], ack 1054, win 65535, length 0
12:26:12.513402 IP 88.212.201.82.443 > 10.0.2.15.54258: Flags [P.], seq 5834:6303, ack 1054, win 65535, length 469
12:26:12.513410 IP 10.0.2.15.54258 > 88.212.201.82.443: Flags [.], ack 6303, win 63900, length 0
12:26:12.514761 IP 77.88.21.179.443 > 10.0.2.15.52332: Flags [P.], seq 1:1411, ack 518, win 65535, length 1410
12:26:12.514797 IP 10.0.2.15.52332 > 77.88.21.179.443: Flags [.], ack 1411, win 63450, length 0
12:26:12.521302 IP 77.88.21.179.443 > 10.0.2.15.52332: Flags [P.], seq 1411:2821, ack 518, win 65535, length 1410
12:26:12.521355 IP 10.0.2.15.52332 > 77.88.21.179.443: Flags [.], ack 2821, win 62040, length 0
12:26:12.528797 IP 77.88.21.179.443 > 10.0.2.15.52332: Flags [P.], seq 2821:4231, ack 518, win 65535, length 1410
12:26:12.528833 IP 10.0.2.15.52332 > 77.88.21.179.443: Flags [.], ack 4231, win 63450, length 0
12:26:12.532928 IP 87.250.251.119.443 > 10.0.2.15.33128: Flags [P.], seq 4231:4364, ack 518, win 65535, length 133
12:26:12.533013 IP 10.0.2.15.33128 > 87.250.251.119.443: Flags [.], ack 4364, win 63450, length 0
12:26:12.533064 IP 79.171.117.17.443 > 10.0.2.15.41566: Flags [P.], seq 11412:12822, ack 1597, win 65535, length 1410
12:26:12.533079 IP 10.0.2.15.41566 > 79.171.117.17.443: Flags [.], ack 12822, win 63450, length 0
12:26:12.540822 IP 77.88.21.179.443 > 10.0.2.15.52332: Flags [P.], seq 4231:4663, ack 518, win 65535, length 432
12:26:12.540886 IP 10.0.2.15.52332 > 77.88.21.179.443: Flags [.], ack 4663, win 63450, length 0
12:26:12.542291 IP 62.76.25.28.443 > 10.0.2.15.54772: Flags [P.], seq 2951:3225, ack 983, win 65535, length 274
12:26:12.542314 IP 10.0.2.15.54772 > 62.76.25.28.443: Flags [.], ack 3225, win 63900, length 0
12:26:12.542464 IP 62.76.25.28.443 > 10.0.2.15.54772: Flags [P.], seq 3225:3294, ack 983, win 65535, length 69
12:26:12.542474 IP 10.0.2.15.54772 > 62.76.25.28.443: Flags [.], ack 3294, win 63900, length 0
12:26:12.543509 IP 62.76.25.28.443 > 10.0.2.15.54790: Flags [P.], seq 1:1441, ack 518, win 65535, length 1440
12:26:12.543529 IP 10.0.2.15.54790 > 62.76.25.28.443: Flags [.], ack 1441, win 63900, length 0
12:26:12.549881 IP 79.171.117.17.443 > 10.0.2.15.41566: Flags [P.], seq 12822:14232, ack 1597, win 65535, length 1410
12:26:12.549977 IP 10.0.2.15.41566 > 79.171.117.17.443: Flags [.], ack 14232, win 62040, length 0
12:26:12.555304 IP 54.228.203.167.443 > 10.0.2.15.49174: Flags [P.], seq 5288:5339, ack 644, win 65535, length 51
12:26:12.555344 IP 10.0.2.15.49174 > 54.228.203.167.443: Flags [.], ack 5339, win 63900, length 0
12:26:12.555959 IP 10.0.2.15.54772 > 62.76.25.28.443: Flags [P.], seq 983:1021, ack 3294, win 63900, length 38
12:26:12.556038 IP 62.76.25.28.443 > 10.0.2.15.54790: Flags [P.], seq 1441:2881, ack 518, win 65535, length 1440
12:26:12.556048 IP 10.0.2.15.54790 > 62.76.25.28.443: Flags [.], ack 2881, win 63900, length 0
12:26:12.556403 IP 62.76.25.28.443 > 10.0.2.15.54772: Flags [.], ack 1021, win 65535, length 0
12:26:12.557119 IP 10.0.2.15.49174 > 54.228.203.167.443: Flags [P.], seq 644:1059, ack 5339, win 63900, length 415
12:26:12.557881 IP 54.228.203.167.443 > 10.0.2.15.49174: Flags [.], ack 1059, win 65535, length 0
12:26:12.558526 IP 10.0.2.15.33128 > 87.250.251.119.443: Flags [P.], seq 518:598, ack 4364, win 63450, length 80
12:26:12.558867 IP 10.0.2.15.33128 > 87.250.251.119.443: Flags [P.], seq 598:690, ack 4364, win 63450, length 92
12:26:12.559224 IP 87.250.251.119.443 > 10.0.2.15.33128: Flags [.], ack 598, win 65535, length 0
12:26:12.559239 IP 87.250.251.119.443 > 10.0.2.15.33128: Flags [.], ack 690, win 65535, length 0
12:26:12.559409 IP 10.0.2.15.33128 > 87.250.251.119.443: Flags [P.], seq 690:1145, ack 4364, win 63450, length 455
12:26:12.559976 IP 87.250.251.119.443 > 10.0.2.15.33128: Flags [.], ack 1145, win 65535, length 0
12:26:12.564328 IP 79.171.117.17.443 > 10.0.2.15.41566: Flags [P.], seq 14232:15642, ack 1597, win 65535, length 1410
12:26:12.564601 IP 10.0.2.15.52332 > 77.88.21.179.443: Flags [P.], seq 518:598, ack 4663, win 63450, length 80
12:26:12.566429 IP 77.88.21.179.443 > 10.0.2.15.52332: Flags [.], ack 598, win 65535, length 0
12:26:12.568193 IP 62.76.25.28.443 > 10.0.2.15.54790: Flags [P.], seq 2881:2950, ack 518, win 65535, length 69
12:26:12.568239 IP 10.0.2.15.54790 > 62.76.25.28.443: Flags [.], ack 2950, win 63900, length 0
12:26:12.568262 IP 62.76.25.28.443 > 10.0.2.15.54772: Flags [P.], seq 3294:3332, ack 1021, win 65535, length 38
12:26:12.568272 IP 10.0.2.15.54772 > 62.76.25.28.443: Flags [.], ack 3332, win 63900, length 0
12:26:12.569706 IP 62.76.25.28.443 > 10.0.2.15.54772: Flags [P.], seq 3332:4772, ack 1021, win 65535, length 1440
12:26:12.569784 IP 10.0.2.15.54772 > 62.76.25.28.443: Flags [.], ack 4772, win 62480, length 0
12:26:12.571772 IP 10.0.2.15.54790 > 62.76.25.28.443: Flags [P.], seq 518:611, ack 2950, win 63900, length 93
12:26:12.572795 IP 10.0.2.15.59422 > 104.19.133.78.443: Flags [S], seq 2190929673, win 64240, options [mss 1460,sackOK,TS val 3465132896 ecr 0,nop,wscale 10], length 0
