12:24:39.130981 IP 10.0.2.15.56823 > 216.58.213.4.443: UDP, length 155
12:24:39.234507 IP 216.58.213.4.443 > 10.0.2.15.56823: UDP, length 230
12:24:39.242605 IP 216.58.213.4.443 > 10.0.2.15.56823: UDP, length 27
12:24:39.243044 IP 10.0.2.15.56823 > 216.58.213.4.443: UDP, length 33
12:24:39.243890 IP 216.58.213.4.443 > 10.0.2.15.56823: UDP, length 63
12:24:39.270647 IP 10.0.2.15.56823 > 216.58.213.4.443: UDP, length 33
12:24:40.259388 IP 10.0.2.15.44770 > 212.129.31.248.443: Flags [S], seq 1765963750, win 64240, options [mss 1460,sackOK,TS val 576681723 ecr 0,nop,wscale 10], length 0
12:24:40.260749 IP 10.0.2.15.41130 > 104.16.18.94.443: Flags [S], seq 2562231324, win 64240, options [mss 1460,sackOK,TS val 1077179140 ecr 0,nop,wscale 10], length 0
12:24:40.261096 IP 10.0.2.15.60846 > 104.27.164.201.443: Flags [S], seq 2156159854, win 64240, options [mss 1460,sackOK,TS val 3359698878 ecr 0,nop,wscale 10], length 0
12:24:40.265424 IP 10.0.2.15.56086 > 178.154.131.215.443: Flags [S], seq 591736622, win 64240, options [mss 1460,sackOK,TS val 3678827162 ecr 0,nop,wscale 10], length 0
12:24:40.266484 IP 10.0.2.15.37896 > 172.217.17.67.443: UDP, length 1350
12:24:40.267444 IP 10.0.2.15.47740 > 213.180.193.90.443: Flags [S], seq 2609533914, win 64240, options [mss 1460,sackOK,TS val 1466596023 ecr 0,nop,wscale 10], length 0
12:24:40.348093 IP 212.129.31.248.443 > 10.0.2.15.44770: Flags [S.], seq 595776001, ack 1765963751, win 65535, options [mss 1460], length 0
12:24:40.348200 IP 10.0.2.15.44770 > 212.129.31.248.443: Flags [.], ack 1, win 64240, length 0
12:24:40.348685 IP 10.0.2.15.44770 > 212.129.31.248.443: Flags [P.], seq 1:518, ack 1, win 64240, length 517
12:24:40.349056 IP 212.129.31.248.443 > 10.0.2.15.44770: Flags [.], ack 518, win 65535, length 0
12:24:40.356807 IP 172.217.17.67.443 > 10.0.2.15.37896: UDP, length 1350
12:24:40.358365 IP 172.217.17.67.443 > 10.0.2.15.37896: UDP, length 1350
12:24:40.358653 IP 104.16.18.94.443 > 10.0.2.15.41130: Flags [S.], seq 595840001, ack 2562231325, win 65535, options [mss 1460], length 0
12:24:40.358705 IP 10.0.2.15.41130 > 104.16.18.94.443: Flags [.], ack 1, win 64240, length 0
12:24:40.359699 IP 10.0.2.15.37896 > 172.217.17.67.443: UDP, length 42
12:24:40.360076 IP 10.0.2.15.41130 > 104.16.18.94.443: Flags [P.], seq 1:518, ack 1, win 64240, length 517
12:24:40.360476 IP 104.16.18.94.443 > 10.0.2.15.41130: Flags [.], ack 518, win 65535, length 0
12:24:40.361810 IP 10.0.2.15.37896 > 172.217.17.67.443: UDP, length 1350
12:24:40.364176 IP 104.27.164.201.443 > 10.0.2.15.60846: Flags [S.], seq 595904001, ack 2156159855, win 65535, options [mss 1460], length 0
12:24:40.364225 IP 10.0.2.15.60846 > 104.27.164.201.443: Flags [.], ack 1, win 64240, length 0
12:24:40.364443 IP 10.0.2.15.60846 > 104.27.164.201.443: Flags [P.], seq 1:518, ack 1, win 64240, length 517
12:24:40.364691 IP 104.27.164.201.443 > 10.0.2.15.60846: Flags [.], ack 518, win 65535, length 0
12:24:40.374483 IP 178.154.131.215.443 > 10.0.2.15.56086: Flags [S.], seq 595968001, ack 591736623, win 65535, options [mss 1460], length 0
12:24:40.374582 IP 10.0.2.15.56086 > 178.154.131.215.443: Flags [.], ack 1, win 64240, length 0
12:24:40.375044 IP 10.0.2.15.56086 > 178.154.131.215.443: Flags [P.], seq 1:518, ack 1, win 64240, length 517
12:24:40.375289 IP 178.154.131.215.443 > 10.0.2.15.56086: Flags [.], ack 518, win 65535, length 0
12:24:40.401409 IP 213.180.193.90.443 > 10.0.2.15.47740: Flags [S.], seq 596032001, ack 2609533915, win 65535, options [mss 1460], length 0
12:24:40.401580 IP 10.0.2.15.47740 > 213.180.193.90.443: Flags [.], ack 1, win 64240, length 0
12:24:40.402132 IP 10.0.2.15.47740 > 213.180.193.90.443: Flags [P.], seq 1:518, ack 1, win 64240, length 517
12:24:40.403377 IP 213.180.193.90.443 > 10.0.2.15.47740: Flags [.], ack 518, win 65535, length 0
12:24:40.444647 IP 212.129.31.248.443 > 10.0.2.15.44770: Flags [P.], seq 1:1441, ack 518, win 65535, length 1440
12:24:40.444733 IP 10.0.2.15.44770 > 212.129.31.248.443: Flags [.], ack 1441, win 63900, length 0
12:24:40.445652 IP 212.129.31.248.443 > 10.0.2.15.44770: Flags [P.], seq 1441:2956, ack 518, win 65535, length 1515
12:24:40.445660 IP 10.0.2.15.44770 > 212.129.31.248.443: Flags [.], ack 2956, win 63900, length 0
12:24:40.450227 IP 10.0.2.15.44770 > 212.129.31.248.443: Flags [P.], seq 518:611, ack 2956, win 63900, length 93
12:24:40.450627 IP 10.0.2.15.44770 > 212.129.31.248.443: Flags [P.], seq 611:710, ack 2956, win 63900, length 99
12:24:40.451010 IP 10.0.2.15.44770 > 212.129.31.248.443: Flags [P.], seq 710:1265, ack 2956, win 63900, length 555
12:24:40.451055 IP 212.129.31.248.443 > 10.0.2.15.44770: Flags [.], ack 611, win 65535, length 0
12:24:40.451097 IP 212.129.31.248.443 > 10.0.2.15.44770: Flags [.], ack 710, win 65535, length 0
12:24:40.451575 IP 212.129.31.248.443 > 10.0.2.15.44770: Flags [.], ack 1265, win 65535, length 0
12:24:40.460247 IP 172.217.17.67.443 > 10.0.2.15.37896: UDP, length 1350
12:24:40.461268 IP 10.0.2.15.37896 > 172.217.17.67.443: UDP, length 33
12:24:40.465619 IP 104.16.18.94.443 > 10.0.2.15.41130: Flags [P.], seq 1:1441, ack 518, win 65535, length 1440
12:24:40.465652 IP 10.0.2.15.41130 > 104.16.18.94.443: Flags [.], ack 1441, win 63900, length 0
12:24:40.466535 IP 104.16.18.94.443 > 10.0.2.15.41130: Flags [P.], seq 1441:1994, ack 518, win 65535, length 553
12:24:40.466563 IP 10.0.2.15.41130 > 104.16.18.94.443: Flags [.], ack 1994, win 63900, length 0
12:24:40.470007 IP 10.0.2.15.41130 > 104.16.18.94.443: Flags [P.], seq 518:582, ack 1994, win 63900, length 64
12:24:40.470747 IP 104.16.18.94.443 > 10.0.2.15.41130: Flags [.], ack 582, win 65535, length 0
12:24:40.492742 IP 104.27.164.201.443 > 10.0.2.15.60846: Flags [P.], seq 1:1821, ack 518, win 65535, length 1820
12:24:40.492803 IP 10.0.2.15.60846 > 104.27.164.201.443: Flags [.], ack 1821, win 62480, length 0
12:24:40.497558 IP 10.0.2.15.60846 > 104.27.164.201.443: Flags [P.], seq 518:582, ack 1821, win 63900, length 64
12:24:40.498720 IP 104.27.164.201.443 > 10.0.2.15.60846: Flags [.], ack 582, win 65535, length 0
12:24:40.504367 IP 178.154.131.215.443 > 10.0.2.15.56086: Flags [P.], seq 1:2821, ack 518, win 65535, length 2820
12:24:40.504457 IP 10.0.2.15.56086 > 178.154.131.215.443: Flags [.], ack 2821, win 62480, length 0
12:24:40.509223 IP 178.154.131.215.443 > 10.0.2.15.56086: Flags [P.], seq 2821:4674, ack 518, win 65535, length 1853
12:24:40.509284 IP 10.0.2.15.56086 > 178.154.131.215.443: Flags [.], ack 4674, win 62480, length 0
12:24:40.516355 IP 10.0.2.15.56086 > 178.154.131.215.443: Flags [P.], seq 518:598, ack 4674, win 63900, length 80
12:24:40.516978 IP 178.154.131.215.443 > 10.0.2.15.56086: Flags [.], ack 598, win 65535, length 0
12:24:40.528308 IP 213.180.193.90.443 > 10.0.2.15.47740: Flags [P.], seq 1:1411, ack 518, win 65535, length 1410
12:24:40.528377 IP 10.0.2.15.47740 > 213.180.193.90.443: Flags [.], ack 1411, win 63450, length 0
12:24:40.529687 IP 213.180.193.90.443 > 10.0.2.15.47740: Flags [P.], seq 1411:2821, ack 518, win 65535, length 1410
12:24:40.529730 IP 10.0.2.15.47740 > 213.180.193.90.443: Flags [.], ack 2821, win 63450, length 0
12:24:40.532132 IP 213.180.193.90.443 > 10.0.2.15.47740: Flags [P.], seq 2821:4231, ack 518, win 65535, length 1410
12:24:40.532198 IP 10.0.2.15.47740 > 213.180.193.90.443: Flags [.], ack 4231, win 63450, length 0
12:24:40.535520 IP 213.180.193.90.443 > 10.0.2.15.47740: Flags [P.], seq 4231:4551, ack 518, win 65535, length 320
12:24:40.535555 IP 10.0.2.15.47740 > 213.180.193.90.443: Flags [.], ack 4551, win 63450, length 0
12:24:40.538975 IP 10.0.2.15.47740 > 213.180.193.90.443: Flags [P.], seq 518:644, ack 4551, win 63450, length 126
12:24:40.539540 IP 213.180.193.90.443 > 10.0.2.15.47740: Flags [.], ack 644, win 65535, length 0
12:24:40.540233 IP 212.129.31.248.443 > 10.0.2.15.44770: Flags [P.], seq 2956:3321, ack 1265, win 65535, length 365
12:24:40.540248 IP 10.0.2.15.44770 > 212.129.31.248.443: Flags [.], ack 3321, win 63900, length 0
12:24:40.540407 IP 10.0.2.15.44770 > 212.129.31.248.443: Flags [P.], seq 1265:1303, ack 3321, win 63900, length 38
12:24:40.540848 IP 212.129.31.248.443 > 10.0.2.15.44770: Flags [.], ack 1303, win 65535, length 0
12:24:40.552705 IP 212.129.31.248.443 > 10.0.2.15.44770: Flags [P.], seq 3321:4761, ack 1303, win 65535, length 1440
12:24:40.552822 IP 10.0.2.15.44770 > 212.129.31.248.443: Flags [.], ack 4761, win 63900, length 0
12:24:40.554516 IP 212.129.31.248.443 > 10.0.2.15.44770: Flags [P.], seq 4761:6201, ack 1303, win 65535, length 1440
12:24:40.554563 IP 10.0.2.15.44770 > 212.129.31.248.443: Flags [.], ack 6201, win 63900, length 0
12:24:40.559513 IP 212.129.31.248.443 > 10.0.2.15.44770: Flags [P.], seq 6201:7641, ack 1303, win 65535, length 1440
12:24:40.559585 IP 10.0.2.15.44770 > 212.129.31.248.443: Flags [.], ack 7641, win 63900, length 0
12:24:40.561818 IP 212.129.31.248.443 > 10.0.2.15.44770: Flags [P.], seq 7641:9081, ack 1303, win 65535, length 1440
12:24:40.561861 IP 10.0.2.15.44770 > 212.129.31.248.443: Flags [.], ack 9081, win 63900, length 0
12:24:40.566479 IP 212.129.31.248.443 > 10.0.2.15.44770: Flags [P.], seq 9081:10521, ack 1303, win 65535, length 1440
12:24:40.566509 IP 10.0.2.15.44770 > 212.129.31.248.443: Flags [.], ack 10521, win 63900, length 0
12:24:40.577612 IP 104.16.18.94.443 > 10.0.2.15.41130: Flags [P.], seq 1994:2522, ack 582, win 65535, length 528
12:24:40.577649 IP 10.0.2.15.41130 > 104.16.18.94.443: Flags [.], ack 2522, win 63900, length 0
12:24:40.577682 IP 212.129.31.248.443 > 10.0.2.15.44770: Flags [P.], seq 10521:11961, ack 1303, win 65535, length 1440
12:24:40.577687 IP 10.0.2.15.44770 > 212.129.31.248.443: Flags [.], ack 11961, win 63900, length 0
12:24:40.584601 IP 212.129.31.248.443 > 10.0.2.15.44770: Flags [P.], seq 11961:13401, ack 1303, win 65535, length 1440
12:24:40.584693 IP 10.0.2.15.44770 > 212.129.31.248.443: Flags [.], ack 13401, win 63900, length 0
12:24:40.601581 IP 104.27.164.201.443 > 10.0.2.15.60846: Flags [P.], seq 1821:2333, ack 582, win 65535, length 512
12:24:40.601609 IP 10.0.2.15.60846 > 104.27.164.201.443: Flags [.], ack 2333, win 63900, length 0
12:24:40.625847 IP 178.154.131.215.443 > 10.0.2.15.56086: Flags [P.], seq 4674:4969, ack 598, win 65535, length 295
12:24:40.625887 IP 10.0.2.15.56086 > 178.154.131.215.443: Flags [.], ack 4969, win 63900, length 0
12:24:40.627089 IP 178.154.131.215.443 > 10.0.2.15.56086: Flags [P.], seq 4969:5326, ack 598, win 65535, length 357
12:24:40.627116 IP 10.0.2.15.56086 > 178.154.131.215.443: Flags [.], ack 5326, win 63900, length 0
12:24:40.647104 IP 212.129.31.248.443 > 10.0.2.15.44770: Flags [P.], seq 13401:14841, ack 1303, win 65535, length 1440
12:24:40.647137 IP 10.0.2.15.44770 > 212.129.31.248.443: Flags [.], ack 14841, win 63900, length 0
12:24:40.650730 IP 212.129.31.248.443 > 10.0.2.15.44770: Flags [P.], seq 14841:17721, ack 1303, win 65535, length 2880
12:24:40.650894 IP 10.0.2.15.44770 > 212.129.31.248.443: Flags [.], ack 17721, win 62480, length 0
12:24:40.656695 IP 212.129.31.248.443 > 10.0.2.15.44770: Flags [P.], seq 17721:19161, ack 1303, win 65535, length 1440
12:24:40.659725 IP 10.0.2.15.44770 > 212.129.31.248.443: Flags [.], ack 19161, win 63900, length 0
12:24:40.661965 IP 212.129.31.248.443 > 10.0.2.15.44770: Flags [P.], seq 19161:20601, ack 1303, win 65535, length 1440
12:24:40.662010 IP 10.0.2.15.44770 > 212.129.31.248.443: Flags [.], ack 20601, win 63900, length 0
12:24:40.669109 IP 213.180.193.90.443 > 10.0.2.15.47740: Flags [P.], seq 4551:4878, ack 644, win 65535, length 327
12:24:40.669152 IP 10.0.2.15.47740 > 213.180.193.90.443: Flags [.], ack 4878, win 63450, length 0
12:24:40.671631 IP 212.129.31.248.443 > 10.0.2.15.44770: Flags [P.], seq 20601:22041, ack 1303, win 65535, length 1440
12:24:40.671664 IP 10.0.2.15.44770 > 212.129.31.248.443: Flags [.], ack 22041, win 63900, length 0
12:24:40.676024 IP 212.129.31.248.443 > 10.0.2.15.44770: Flags [P.], seq 22041:23481, ack 1303, win 65535, length 1440
12:24:40.676104 IP 10.0.2.15.44770 > 212.129.31.248.443: Flags [.], ack 23481, win 63900, length 0
12:24:40.683798 IP 212.129.31.248.443 > 10.0.2.15.44770: Flags [P.], seq 23481:24921, ack 1303, win 65535, length 1440
12:24:40.683865 IP 10.0.2.15.44770 > 212.129.31.248.443: Flags [.], ack 24921, win 63900, length 0
12:24:40.687760 IP 212.129.31.248.443 > 10.0.2.15.44770: Flags [P.], seq 24921:26361, ack 1303, win 65535, length 1440
12:24:40.687837 IP 10.0.2.15.44770 > 212.129.31.248.443: Flags [.], ack 26361, win 63900, length 0
12:24:40.695894 IP 212.129.31.248.443 > 10.0.2.15.44770: Flags [P.], seq 26361:27801, ack 1303, win 65535, length 1440
12:24:40.695955 IP 10.0.2.15.44770 > 212.129.31.248.443: Flags [.], ack 27801, win 63900, length 0
12:24:40.699650 IP 212.129.31.248.443 > 10.0.2.15.44770: Flags [P.], seq 27801:29053, ack 1303, win 65535, length 1252
12:24:40.699772 IP 10.0.2.15.44770 > 212.129.31.248.443: Flags [.], ack 29053, win 63900, length 0
12:24:40.811165 IP 10.0.2.15.52076 > 77.88.21.179.443: Flags [S], seq 1004425804, win 64240, options [mss 1460,sackOK,TS val 1281302567 ecr 0,nop,wscale 10], length 0
12:24:40.820336 IP 10.0.2.15.54014 > 88.212.201.82.443: Flags [S], seq 151042979, win 64240, options [mss 1460,sackOK,TS val 2221313943 ecr 0,nop,wscale 10], length 0
12:24:40.828115 IP 10.0.2.15.41326 > 79.171.117.17.443: Flags [S], seq 3661909336, win 64240, options [mss 1460,sackOK,TS val 2014830689 ecr 0,nop,wscale 10], length 0
12:24:40.904489 IP 10.0.2.15.54938 > 93.158.134.118.443: Flags [S], seq 1116159605, win 64240, options [mss 1460,sackOK,TS val 379366857 ecr 0,nop,wscale 10], length 0
12:24:40.909936 IP 10.0.2.15.44770 > 212.129.31.248.443: Flags [P.], seq 1303:1478, ack 29053, win 63900, length 175
12:24:40.911695 IP 212.129.31.248.443 > 10.0.2.15.44770: Flags [.], ack 1478, win 65535, length 0
12:24:40.913592 IP 79.171.117.17.443 > 10.0.2.15.41326: Flags [S.], seq 596160001, ack 3661909337, win 65535, options [mss 1460], length 0
12:24:40.913638 IP 10.0.2.15.41326 > 79.171.117.17.443: Flags [.], ack 1, win 64240, length 0
12:24:40.913951 IP 10.0.2.15.41326 > 79.171.117.17.443: Flags [P.], seq 1:518, ack 1, win 64240, length 517
12:24:40.914516 IP 79.171.117.17.443 > 10.0.2.15.41326: Flags [.], ack 518, win 65535, length 0
12:24:40.940870 IP 88.212.201.82.443 > 10.0.2.15.54014: Flags [S.], seq 596224001, ack 151042980, win 65535, options [mss 1460], length 0
12:24:40.940986 IP 10.0.2.15.54014 > 88.212.201.82.443: Flags [.], ack 1, win 64240, length 0
12:24:40.943062 IP 10.0.2.15.54014 > 88.212.201.82.443: Flags [P.], seq 1:518, ack 1, win 64240, length 517
12:24:40.944333 IP 88.212.201.82.443 > 10.0.2.15.54014: Flags [.], ack 518, win 65535, length 0
12:24:40.947616 IP 77.88.21.179.443 > 10.0.2.15.52076: Flags [S.], seq 596288001, ack 1004425805, win 65535, options [mss 1460], length 0
12:24:40.947760 IP 10.0.2.15.52076 > 77.88.21.179.443: Flags [.], ack 1, win 64240, length 0
12:24:40.949018 IP 10.0.2.15.52076 > 77.88.21.179.443: Flags [P.], seq 1:518, ack 1, win 64240, length 517
12:24:40.950117 IP 77.88.21.179.443 > 10.0.2.15.52076: Flags [.], ack 518, win 65535, length 0
12:24:41.005011 IP 79.171.117.17.443 > 10.0.2.15.41326: Flags [P.], seq 1:100, ack 518, win 65535, length 99
12:24:41.005091 IP 10.0.2.15.41326 > 79.171.117.17.443: Flags [.], ack 100, win 64141, length 0
12:24:41.007885 IP 10.0.2.15.41326 > 79.171.117.17.443: Flags [P.], seq 518:1041, ack 100, win 64141, length 523
12:24:41.008840 IP 79.171.117.17.443 > 10.0.2.15.41326: Flags [.], ack 1041, win 65535, length 0
12:24:41.011396 IP 212.129.31.248.443 > 10.0.2.15.44770: Flags [P.], seq 29053:30493, ack 1478, win 65535, length 1440
12:24:41.011439 IP 10.0.2.15.44770 > 212.129.31.248.443: Flags [.], ack 30493, win 63900, length 0
12:24:41.012773 IP 212.129.31.248.443 > 10.0.2.15.44770: Flags [P.], seq 30493:31933, ack 1478, win 65535, length 1440
12:24:41.012792 IP 10.0.2.15.44770 > 212.129.31.248.443: Flags [.], ack 31933, win 62480, length 0
12:24:41.014697 IP 212.129.31.248.443 > 10.0.2.15.44770: Flags [P.], seq 31933:33373, ack 1478, win 65535, length 1440
12:24:41.014708 IP 10.0.2.15.44770 > 212.129.31.248.443: Flags [.], ack 33373, win 61060, length 0
12:24:41.019906 IP 212.129.31.248.443 > 10.0.2.15.44770: Flags [P.], seq 33373:34813, ack 1478, win 65535, length 1440
12:24:41.019967 IP 10.0.2.15.44770 > 212.129.31.248.443: Flags [.], ack 34813, win 63900, length 0
12:24:41.027755 IP 212.129.31.248.443 > 10.0.2.15.44770: Flags [P.], seq 34813:36253, ack 1478, win 65535, length 1440
12:24:41.027850 IP 10.0.2.15.44770 > 212.129.31.248.443: Flags [.], ack 36253, win 62480, length 0
12:24:41.032023 IP 212.129.31.248.443 > 10.0.2.15.44770: Flags [P.], seq 36253:37693, ack 1478, win 65535, length 1440
12:24:41.032094 IP 10.0.2.15.44770 > 212.129.31.248.443: Flags [.], ack 37693, win 61060, length 0
12:24:41.037920 IP 212.129.31.248.443 > 10.0.2.15.44770: Flags [P.], seq 37693:39133, ack 1478, win 65535, length 1440
12:24:41.037952 IP 10.0.2.15.44770 > 212.129.31.248.443: Flags [.], ack 39133, win 59640, length 0
12:24:41.044146 IP 212.129.31.248.443 > 10.0.2.15.44770: Flags [P.], seq 39133:40573, ack 1478, win 65535, length 1440
12:24:41.044243 IP 10.0.2.15.44770 > 212.129.31.248.443: Flags [.], ack 40573, win 58220, length 0
12:24:41.052050 IP 93.158.134.118.443 > 10.0.2.15.54938: Flags [S.], seq 596352001, ack 1116159606, win 65535, options [mss 1460], length 0
12:24:41.052125 IP 10.0.2.15.54938 > 93.158.134.118.443: Flags [.], ack 1, win 64240, length 0
12:24:41.052589 IP 212.129.31.248.443 > 10.0.2.15.44770: Flags [P.], seq 40573:42013, ack 1478, win 65535, length 1440
12:24:41.052601 IP 10.0.2.15.44770 > 212.129.31.248.443: Flags [.], ack 42013, win 56800, length 0
12:24:41.055675 IP 212.129.31.248.443 > 10.0.2.15.44770: Flags [P.], seq 42013:43453, ack 1478, win 65535, length 1440
12:24:41.055704 IP 10.0.2.15.44770 > 212.129.31.248.443: Flags [.], ack 43453, win 55380, length 0
12:24:41.056651 IP 10.0.2.15.54938 > 93.158.134.118.443: Flags [P.], seq 1:518, ack 1, win 64240, length 517
12:24:41.057082 IP 93.158.134.118.443 > 10.0.2.15.54938: Flags [.], ack 518, win 65535, length 0
12:24:41.063945 IP 212.129.31.248.443 > 10.0.2.15.44770: Flags [P.], seq 43453:44893, ack 1478, win 65535, length 1440
12:24:41.064007 IP 10.0.2.15.44770 > 212.129.31.248.443: Flags [.], ack 44893, win 63900, length 0
12:24:41.068194 IP 212.129.31.248.443 > 10.0.2.15.44770: Flags [P.], seq 44893:46333, ack 1478, win 65535, length 1440
12:24:41.068259 IP 10.0.2.15.44770 > 212.129.31.248.443: Flags [.], ack 46333, win 63900, length 0
12:24:41.075578 IP 88.212.201.82.443 > 10.0.2.15.54014: Flags [P.], seq 1:1441, ack 518, win 65535, length 1440
12:24:41.075676 IP 10.0.2.15.54014 > 88.212.201.82.443: Flags [.], ack 1441, win 63900, length 0
12:24:41.076585 IP 10.0.2.15.46430 > 62.76.25.27.443: Flags [S], seq 1839984787, win 64240, options [mss 1460,sackOK,TS val 630096207 ecr 0,nop,wscale 10], length 0
12:24:41.076732 IP 10.0.2.15.46432 > 62.76.25.27.443: Flags [S], seq 263945657, win 64240, options [mss 1460,sackOK,TS val 630096207 ecr 0,nop,wscale 10], length 0
12:24:41.076969 IP 10.0.2.15.60080 > 54.246.101.70.443: Flags [S], seq 1942030927, win 64240, options [mss 1460,sackOK,TS val 3842725357 ecr 0,nop,wscale 10], length 0
12:24:41.080586 IP 88.212.201.82.443 > 10.0.2.15.54014: Flags [P.], seq 1441:2881, ack 518, win 65535, length 1440
12:24:41.080636 IP 10.0.2.15.54014 > 88.212.201.82.443: Flags [.], ack 2881, win 63900, length 0
12:24:41.081988 IP 10.0.2.15.60082 > 54.246.101.70.443: Flags [S], seq 3715396036, win 64240, options [mss 1460,sackOK,TS val 3842725362 ecr 0,nop,wscale 10], length 0
12:24:41.082124 IP 10.0.2.15.46438 > 62.76.25.27.443: Flags [S], seq 1679122101, win 64240, options [mss 1460,sackOK,TS val 630096212 ecr 0,nop,wscale 10], length 0
12:24:41.082222 IP 10.0.2.15.46440 > 62.76.25.27.443: Flags [S], seq 1816642589, win 64240, options [mss 1460,sackOK,TS val 630096212 ecr 0,nop,wscale 10], length 0
12:24:41.088387 IP 88.212.201.82.443 > 10.0.2.15.54014: Flags [P.], seq 2881:4321, ack 518, win 65535, length 1440
12:24:41.088486 IP 10.0.2.15.54014 > 88.212.201.82.443: Flags [.], ack 4321, win 63900, length 0
12:24:41.091901 IP 88.212.201.82.443 > 10.0.2.15.54014: Flags [P.], seq 4321:5469, ack 518, win 65535, length 1148
12:24:41.091956 IP 10.0.2.15.54014 > 88.212.201.82.443: Flags [.], ack 5469, win 63900, length 0
12:24:41.100182 IP 212.129.31.248.443 > 10.0.2.15.44770: Flags [P.], seq 46333:47773, ack 1478, win 65535, length 1440
12:24:41.100251 IP 10.0.2.15.44770 > 212.129.31.248.443: Flags [.], ack 47773, win 63900, length 0
12:24:41.108351 IP 77.88.21.179.443 > 10.0.2.15.52076: Flags [P.], seq 1:1411, ack 518, win 65535, length 1410
12:24:41.108369 IP 10.0.2.15.52076 > 77.88.21.179.443: Flags [.], ack 1411, win 63450, length 0
12:24:41.111591 IP 77.88.21.179.443 > 10.0.2.15.52076: Flags [P.], seq 1411:2821, ack 518, win 65535, length 1410
12:24:41.111633 IP 10.0.2.15.52076 > 77.88.21.179.443: Flags [.], ack 2821, win 62040, length 0
12:24:41.116462 IP 77.88.21.179.443 > 10.0.2.15.52076: Flags [P.], seq 2821:4231, ack 518, win 65535, length 1410
12:24:41.116503 IP 10.0.2.15.52076 > 77.88.21.179.443: Flags [.], ack 4231, win 63450, length 0
12:24:41.124296 IP 77.88.21.179.443 > 10.0.2.15.52076: Flags [P.], seq 4231:4663, ack 518, win 65535, length 432
12:24:41.124333 IP 10.0.2.15.52076 > 77.88.21.179.443: Flags [.], ack 4663, win 63450, length 0
12:24:41.124353 IP 212.129.31.248.443 > 10.0.2.15.44770: Flags [P.], seq 47773:49213, ack 1478, win 65535, length 1440
12:24:41.124361 IP 10.0.2.15.44770 > 212.129.31.248.443: Flags [.], ack 49213, win 63900, length 0
12:24:41.124486 IP 10.0.2.15.54014 > 88.212.201.82.443: Flags [P.], seq 518:644, ack 5469, win 63900, length 126
12:24:41.124712 IP 88.212.201.82.443 > 10.0.2.15.54014: Flags [.], ack 644, win 65535, length 0
12:24:41.132507 IP 79.171.117.17.443 > 10.0.2.15.41326: Flags [P.], seq 100:1510, ack 1041, win 65535, length 1410
12:24:41.132610 IP 10.0.2.15.41326 > 79.171.117.17.443: Flags [.], ack 1510, win 63450, length 0
12:24:41.135574 IP 10.0.2.15.52076 > 77.88.21.179.443: Flags [P.], seq 518:598, ack 4663, win 63450, length 80
12:24:41.136085 IP 79.171.117.17.443 > 10.0.2.15.41326: Flags [P.], seq 1510:2920, ack 1041, win 65535, length 1410
12:24:41.136133 IP 10.0.2.15.41326 > 79.171.117.17.443: Flags [.], ack 2920, win 63450, length 0
12:24:41.136498 IP 77.88.21.179.443 > 10.0.2.15.52076: Flags [.], ack 598, win 65535, length 0
12:24:41.139380 IP 10.0.2.15.54014 > 88.212.201.82.443: Flags [P.], seq 644:743, ack 5469, win 63900, length 99
12:24:41.139974 IP 88.212.201.82.443 > 10.0.2.15.54014: Flags [.], ack 743, win 65535, length 0
12:24:41.142601 IP 10.0.2.15.54014 > 88.212.201.82.443: Flags [P.], seq 743:1016, ack 5469, win 63900, length 273
12:24:41.144571 IP 88.212.201.82.443 > 10.0.2.15.54014: Flags [.], ack 1016, win 65535, length 0
12:24:41.144836 IP 79.171.117.17.443 > 10.0.2.15.41326: Flags [P.], seq 2920:3788, ack 1041, win 65535, length 868
12:24:41.144871 IP 10.0.2.15.41326 > 79.171.117.17.443: Flags [.], ack 3788, win 63450, length 0
12:24:41.148740 IP 212.129.31.248.443 > 10.0.2.15.44770: Flags [P.], seq 49213:50653, ack 1478, win 65535, length 1440
12:24:41.148791 IP 10.0.2.15.44770 > 212.129.31.248.443: Flags [.], ack 50653, win 63900, length 0
12:24:41.151604 IP 10.0.2.15.41326 > 79.171.117.17.443: Flags [P.], seq 1041:1115, ack 3788, win 63450, length 74
12:24:41.152194 IP 79.171.117.17.443 > 10.0.2.15.41326: Flags [.], ack 1115, win 65535, length 0
12:24:41.152615 IP 212.129.31.248.443 > 10.0.2.15.44770: Flags [P.], seq 50653:52093, ack 1478, win 65535, length 1440
12:24:41.152627 IP 10.0.2.15.44770 > 212.129.31.248.443: Flags [.], ack 52093, win 63900, length 0
12:24:41.153613 IP 10.0.2.15.41326 > 79.171.117.17.443: Flags [P.], seq 1115:1597, ack 3788, win 63450, length 482
12:24:41.154004 IP 79.171.117.17.443 > 10.0.2.15.41326: Flags [.], ack 1597, win 65535, length 0
12:24:41.160233 IP 212.129.31.248.443 > 10.0.2.15.44770: Flags [P.], seq 52093:53533, ack 1478, win 65535, length 1440
12:24:41.160308 IP 10.0.2.15.44770 > 212.129.31.248.443: Flags [.], ack 53533, win 63900, length 0
12:24:41.164283 IP 212.129.31.248.443 > 10.0.2.15.44770: Flags [P.], seq 53533:54784, ack 1478, win 65535, length 1251
12:24:41.164490 IP 10.0.2.15.44770 > 212.129.31.248.443: Flags [.], ack 54784, win 63900, length 0
12:24:41.181127 IP 54.246.101.70.443 > 10.0.2.15.60080: Flags [S.], seq 596416001, ack 1942030928, win 65535, options [mss 1460], length 0
12:24:41.181333 IP 10.0.2.15.60080 > 54.246.101.70.443: Flags [.], ack 1, win 64240, length 0
12:24:41.181816 IP 10.0.2.15.60080 > 54.246.101.70.443: Flags [P.], seq 1:518, ack 1, win 64240, length 517
12:24:41.182868 IP 54.246.101.70.443 > 10.0.2.15.60080: Flags [.], ack 518, win 65535, length 0
12:24:41.195775 IP 62.76.25.27.443 > 10.0.2.15.46430: Flags [S.], seq 596480001, ack 1839984788, win 65535, options [mss 1460], length 0
12:24:41.195889 IP 10.0.2.15.46430 > 62.76.25.27.443: Flags [.], ack 1, win 64240, length 0
12:24:41.196325 IP 10.0.2.15.46430 > 62.76.25.27.443: Flags [P.], seq 1:518, ack 1, win 64240, length 517
12:24:41.197443 IP 62.76.25.27.443 > 10.0.2.15.46432: Flags [S.], seq 596544001, ack 263945658, win 65535, options [mss 1460], length 0
12:24:41.197517 IP 10.0.2.15.46432 > 62.76.25.27.443: Flags [.], ack 1, win 64240, length 0
12:24:41.197537 IP 62.76.25.27.443 > 10.0.2.15.46430: Flags [.], ack 518, win 65535, length 0
12:24:41.197767 IP 10.0.2.15.46432 > 62.76.25.27.443: Flags [P.], seq 1:518, ack 1, win 64240, length 517
12:24:41.198554 IP 62.76.25.27.443 > 10.0.2.15.46432: Flags [.], ack 518, win 65535, length 0
12:24:41.198804 IP 93.158.134.118.443 > 10.0.2.15.54938: Flags [P.], seq 1:1411, ack 518, win 65535, length 1410
12:24:41.198825 IP 10.0.2.15.54938 > 93.158.134.118.443: Flags [.], ack 1411, win 63450, length 0
12:24:41.200412 IP 93.158.134.118.443 > 10.0.2.15.54938: Flags [P.], seq 1411:2821, ack 518, win 65535, length 1410
12:24:41.200448 IP 10.0.2.15.54938 > 93.158.134.118.443: Flags [.], ack 2821, win 63450, length 0
12:24:41.202458 IP 93.158.134.118.443 > 10.0.2.15.54938: Flags [P.], seq 2821:4231, ack 518, win 65535, length 1410
12:24:41.202496 IP 10.0.2.15.54938 > 93.158.134.118.443: Flags [.], ack 4231, win 63450, length 0
12:24:41.208688 IP 93.158.134.118.443 > 10.0.2.15.54938: Flags [P.], seq 4231:4523, ack 518, win 65535, length 292
12:24:41.208760 IP 10.0.2.15.54938 > 93.158.134.118.443: Flags [.], ack 4523, win 63450, length 0
12:24:41.209719 IP 10.0.2.15.54938 > 93.158.134.118.443: Flags [P.], seq 518:611, ack 4523, win 63450, length 93
12:24:41.209956 IP 62.76.25.27.443 > 10.0.2.15.46440: Flags [S.], seq 596608001, ack 1816642590, win 65535, options [mss 1460], length 0
12:24:41.210014 IP 10.0.2.15.46440 > 62.76.25.27.443: Flags [.], ack 1, win 64240, length 0
12:24:41.210069 IP 54.246.101.70.443 > 10.0.2.15.60082: Flags [S.], seq 596672001, ack 3715396037, win 65535, options [mss 1460], length 0
12:24:41.210091 IP 10.0.2.15.60082 > 54.246.101.70.443: Flags [.], ack 1, win 64240, length 0
12:24:41.210428 IP 93.158.134.118.443 > 10.0.2.15.54938: Flags [.], ack 611, win 65535, length 0
12:24:41.218760 IP 62.76.25.27.443 > 10.0.2.15.46438: Flags [S.], seq 596736001, ack 1679122102, win 65535, options [mss 1460], length 0
12:24:41.218868 IP 10.0.2.15.46438 > 62.76.25.27.443: Flags [.], ack 1, win 64240, length 0
12:24:41.219052 IP 10.0.2.15.46440 > 62.76.25.27.443: Flags [P.], seq 1:518, ack 1, win 64240, length 517
12:24:41.219291 IP 10.0.2.15.60082 > 54.246.101.70.443: Flags [P.], seq 1:518, ack 1, win 64240, length 517
12:24:41.219421 IP 10.0.2.15.46438 > 62.76.25.27.443: Flags [P.], seq 1:518, ack 1, win 64240, length 517
12:24:41.219473 IP 10.0.2.15.54938 > 93.158.134.118.443: Flags [P.], seq 611:710, ack 4523, win 63450, length 99
12:24:41.219594 IP 62.76.25.27.443 > 10.0.2.15.46440: Flags [.], ack 518, win 65535, length 0
12:24:41.219672 IP 54.246.101.70.443 > 10.0.2.15.60082: Flags [.], ack 518, win 65535, length 0
12:24:41.219731 IP 62.76.25.27.443 > 10.0.2.15.46438: Flags [.], ack 518, win 65535, length 0
12:24:41.219770 IP 93.158.134.118.443 > 10.0.2.15.54938: Flags [.], ack 710, win 65535, length 0
12:24:41.219781 IP 10.0.2.15.54938 > 93.158.134.118.443: Flags [P.], seq 710:1153, ack 4523, win 63450, length 443
12:24:41.220313 IP 93.158.134.118.443 > 10.0.2.15.54938: Flags [.], ack 1153, win 65535, length 0
12:24:41.239528 IP 79.171.117.17.443 > 10.0.2.15.41326: Flags [P.], seq 3788:4362, ack 1597, win 65535, length 574
12:24:41.239646 IP 10.0.2.15.41326 > 79.171.117.17.443: Flags [.], ack 4362, win 63450, length 0
12:24:41.248622 IP 79.171.117.17.443 > 10.0.2.15.41326: Flags [P.], seq 4362:5772, ack 1597, win 65535, length 1410
12:24:41.248714 IP 10.0.2.15.41326 > 79.171.117.17.443: Flags [.], ack 5772, win 63450, length 0
12:24:41.249543 IP 79.171.117.17.443 > 10.0.2.15.41326: Flags [P.], seq 5772:7182, ack 1597, win 65535, length 1410
12:24:41.249565 IP 10.0.2.15.41326 > 79.171.117.17.443: Flags [.], ack 7182, win 63450, length 0
12:24:41.251364 IP 79.171.117.17.443 > 10.0.2.15.41326: Flags [P.], seq 7182:8592, ack 1597, win 65535, length 1410
12:24:41.251395 IP 10.0.2.15.41326 > 79.171.117.17.443: Flags [.], ack 8592, win 63450, length 0
12:24:41.255303 IP 79.171.117.17.443 > 10.0.2.15.41326: Flags [P.], seq 8592:10002, ack 1597, win 65535, length 1410
12:24:41.255337 IP 10.0.2.15.41326 > 79.171.117.17.443: Flags [.], ack 10002, win 63450, length 0
12:24:41.261802 IP 79.171.117.17.443 > 10.0.2.15.41326: Flags [P.], seq 10002:11412, ack 1597, win 65535, length 1410
12:24:41.261883 IP 10.0.2.15.41326 > 79.171.117.17.443: Flags [.], ack 11412, win 63450, length 0
12:24:41.267973 IP 79.171.117.17.443 > 10.0.2.15.41326: Flags [P.], seq 11412:12822, ack 1597, win 65535, length 1410
12:24:41.268041 IP 10.0.2.15.41326 > 79.171.117.17.443: Flags [.], ack 12822, win 63450, length 0
12:24:41.275844 IP 88.212.201.82.443 > 10.0.2.15.54014: Flags [P.], seq 5469:5834, ack 1016, win 65535, length 365
12:24:41.275925 IP 10.0.2.15.54014 > 88.212.201.82.443: Flags [.], ack 5834, win 63900, length 0
12:24:41.277742 IP 88.212.201.82.443 > 10.0.2.15.54014: Flags [P.], seq 5834:6303, ack 1016, win 65535, length 469
12:24:41.277863 IP 10.0.2.15.54014 > 88.212.201.82.443: Flags [.], ack 6303, win 63900, length 0
12:24:41.279736 IP 79.171.117.17.443 > 10.0.2.15.41326: Flags [P.], seq 12822:14232, ack 1597, win 65535, length 1410
12:24:41.279777 IP 10.0.2.15.41326 > 79.171.117.17.443: Flags [.], ack 14232, win 63450, length 0
12:24:41.283592 IP 77.88.21.179.443 > 10.0.2.15.52076: Flags [P.], seq 4663:5173, ack 598, win 65535, length 510
12:24:41.283628 IP 10.0.2.15.52076 > 77.88.21.179.443: Flags [.], ack 5173, win 63450, length 0
12:24:41.285502 IP 77.88.21.179.443 > 10.0.2.15.52076: Flags [P.], seq 5173:5234, ack 598, win 65535, length 61
12:24:41.285544 IP 10.0.2.15.52076 > 77.88.21.179.443: Flags [.], ack 5234, win 63450, length 0
12:24:41.286403 IP 79.171.117.17.443 > 10.0.2.15.41326: Flags [P.], seq 14232:15642, ack 1597, win 65535, length 1410
12:24:41.286433 IP 10.0.2.15.41326 > 79.171.117.17.443: Flags [.], ack 15642, win 62040, length 0
12:24:41.291764 IP 10.0.2.15.54014 > 88.212.201.82.443: Flags [P.], seq 1016:1054, ack 6303, win 63900, length 38
12:24:41.292992 IP 88.212.201.82.443 > 10.0.2.15.54014: Flags [.], ack 1054, win 65535, length 0
12:24:41.294095 IP 54.246.101.70.443 > 10.0.2.15.60080: Flags [P.], seq 1:1441, ack 518, win 65535, length 1440
12:24:41.294169 IP 10.0.2.15.60080 > 54.246.101.70.443: Flags [.], ack 1441, win 63900, length 0
12:24:41.301063 IP 10.0.2.15.58640 > 96.46.188.133.443: Flags [S], seq 639890111, win 64240, options [mss 1460,sackOK,TS val 1036513441 ecr 0,nop,wscale 10], length 0
12:24:41.303687 IP 54.246.101.70.443 > 10.0.2.15.60080: Flags [P.], seq 1441:2881, ack 518, win 65535, length 1440
12:24:41.303726 IP 10.0.2.15.60080 > 54.246.101.70.443: Flags [.], ack 2881, win 63900, length 0
12:24:41.309321 IP 54.246.101.70.443 > 10.0.2.15.60080: Flags [P.], seq 2881:4097, ack 518, win 65535, length 1216
12:24:41.309368 IP 10.0.2.15.60080 > 54.246.101.70.443: Flags [.], ack 4097, win 63900, length 0
12:24:41.312238 IP 54.246.101.70.443 > 10.0.2.15.60080: Flags [P.], seq 4097:5288, ack 518, win 65535, length 1191
12:24:41.312275 IP 10.0.2.15.60080 > 54.246.101.70.443: Flags [.], ack 5288, win 62709, length 0
12:24:41.317966 IP 10.0.2.15.60080 > 54.246.101.70.443: Flags [P.], seq 518:644, ack 5288, win 62709, length 126
12:24:41.318556 IP 54.246.101.70.443 > 10.0.2.15.60080: Flags [.], ack 644, win 65535, length 0
12:24:41.322282 IP 62.76.25.27.443 > 10.0.2.15.46430: Flags [P.], seq 1:1441, ack 518, win 65535, length 1440
12:24:41.322312 IP 10.0.2.15.46430 > 62.76.25.27.443: Flags [.], ack 1441, win 63900, length 0
12:24:41.326077 IP 62.76.25.27.443 > 10.0.2.15.46430: Flags [P.], seq 1441:2881, ack 518, win 65535, length 1440
12:24:41.326179 IP 10.0.2.15.46430 > 62.76.25.27.443: Flags [.], ack 2881, win 63900, length 0
12:24:41.332906 IP 62.76.25.27.443 > 10.0.2.15.46430: Flags [P.], seq 2881:2951, ack 518, win 65535, length 70
12:24:41.333000 IP 10.0.2.15.46430 > 62.76.25.27.443: Flags [.], ack 2951, win 63830, length 0
12:24:41.334053 IP 62.76.25.27.443 > 10.0.2.15.46432: Flags [P.], seq 1:1441, ack 518, win 65535, length 1440
12:24:41.334092 IP 10.0.2.15.46432 > 62.76.25.27.443: Flags [.], ack 1441, win 63900, length 0
12:24:41.335080 IP 62.76.25.27.443 > 10.0.2.15.46432: Flags [P.], seq 1441:2881, ack 518, win 65535, length 1440
12:24:41.335102 IP 10.0.2.15.46432 > 62.76.25.27.443: Flags [.], ack 2881, win 62480, length 0
12:24:41.340304 IP 62.76.25.27.443 > 10.0.2.15.46432: Flags [P.], seq 2881:2950, ack 518, win 65535, length 69
12:24:41.340397 IP 10.0.2.15.46432 > 62.76.25.27.443: Flags [.], ack 2950, win 62411, length 0
12:24:41.341744 IP 79.171.117.17.443 > 10.0.2.15.41326: Flags [P.], seq 15642:17052, ack 1597, win 65535, length 1410
12:24:41.346846 IP 79.171.117.17.443 > 10.0.2.15.41326: Flags [P.], seq 17052:18462, ack 1597, win 65535, length 1410
12:24:41.346902 IP 10.0.2.15.41326 > 79.171.117.17.443: Flags [.], ack 18462, win 62040, length 0
12:24:41.351920 IP 10.0.2.15.46430 > 62.76.25.27.443: Flags [P.], seq 518:611, ack 2951, win 63830, length 93
12:24:41.352511 IP 62.76.25.27.443 > 10.0.2.15.46430: Flags [.], ack 611, win 65535, length 0
12:24:41.352930 IP 10.0.2.15.46432 > 62.76.25.27.443: Flags [P.], seq 518:611, ack 2950, win 63900, length 93
12:24:41.353098 IP 62.76.25.27.443 > 10.0.2.15.46432: Flags [.], ack 611, win 65535, length 0
12:24:41.354098 IP 62.76.25.27.443 > 10.0.2.15.46440: Flags [P.], seq 1:1441, ack 518, win 65535, length 1440
12:24:41.354137 IP 10.0.2.15.46440 > 62.76.25.27.443: Flags [.], ack 1441, win 63900, length 0
12:24:41.354841 IP 10.0.2.15.46430 > 62.76.25.27.443: Flags [P.], seq 611:710, ack 2951, win 63830, length 99
12:24:41.355141 IP 10.0.2.15.46432 > 62.76.25.27.443: Flags [P.], seq 611:710, ack 2950, win 63900, length 99
12:24:41.355470 IP 62.76.25.27.443 > 10.0.2.15.46430: Flags [.], ack 710, win 65535, length 0
12:24:41.355490 IP 62.76.25.27.443 > 10.0.2.15.46432: Flags [.], ack 710, win 65535, length 0
12:24:41.355560 IP 10.0.2.15.46430 > 62.76.25.27.443: Flags [P.], seq 710:983, ack 2951, win 63830, length 273
12:24:41.355711 IP 10.0.2.15.46432 > 62.76.25.27.443: Flags [P.], seq 710:982, ack 2950, win 63900, length 272
12:24:41.355981 IP 62.76.25.27.443 > 10.0.2.15.46430: Flags [.], ack 983, win 65535, length 0
12:24:41.355988 IP 62.76.25.27.443 > 10.0.2.15.46432: Flags [.], ack 982, win 65535, length 0
12:24:41.363423 IP 79.171.117.17.443 > 10.0.2.15.41326: Flags [P.], seq 18462:19872, ack 1597, win 65535, length 1410
12:24:41.366747 IP 93.158.134.118.443 > 10.0.2.15.54938: Flags [P.], seq 4523:4749, ack 1153, win 65535, length 226
12:24:41.366836 IP 10.0.2.15.54938 > 93.158.134.118.443: Flags [.], ack 4749, win 63450, length 0
12:24:41.368255 IP 54.246.101.70.443 > 10.0.2.15.60082: Flags [P.], seq 1:1441, ack 518, win 65535, length 1440
12:24:41.368330 IP 10.0.2.15.60082 > 54.246.101.70.443: Flags [.], ack 1441, win 63900, length 0
12:24:41.368365 IP 93.158.134.118.443 > 10.0.2.15.54938: Flags [P.], seq 4749:4817, ack 1153, win 65535, length 68
12:24:41.368381 IP 10.0.2.15.54938 > 93.158.134.118.443: Flags [.], ack 4817, win 63450, length 0
12:24:41.372415 IP 54.246.101.70.443 > 10.0.2.15.60082: Flags [P.], seq 1441:2881, ack 518, win 65535, length 1440
12:24:41.372463 IP 10.0.2.15.60082 > 54.246.101.70.443: Flags [.], ack 2881, win 62480, length 0
12:24:41.376996 IP 10.0.2.15.54938 > 93.158.134.118.443: Flags [P.], seq 1153:1191, ack 4817, win 63450, length 38
12:24:41.378427 IP 93.158.134.118.443 > 10.0.2.15.54938: Flags [.], ack 1191, win 65535, length 0
12:24:41.379967 IP 54.246.101.70.443 > 10.0.2.15.60082: Flags [P.], seq 2881:4097, ack 518, win 65535, length 1216
12:24:41.379992 IP 10.0.2.15.60082 > 54.246.101.70.443: Flags [.], ack 4097, win 63900, length 0
12:24:41.380330 IP 10.0.2.15.52388 > 192.0.76.3.443: Flags [S], seq 3255282647, win 64240, options [mss 1460,sackOK,TS val 2651815698 ecr 0,nop,wscale 10], length 0
12:24:41.381321 IP 10.0.2.15.54014 > 88.212.201.82.443: Flags [P.], seq 1054:1123, ack 6303, win 63900, length 69
12:24:41.382192 IP 88.212.201.82.443 > 10.0.2.15.54014: Flags [.], ack 1123, win 65535, length 0
12:24:41.384166 IP 10.0.2.15.36262 > 87.250.247.182.443: Flags [S], seq 1340726342, win 64240, options [mss 1460,sackOK,TS val 1776394917 ecr 0,nop,wscale 10], length 0
12:24:41.384458 IP 10.0.2.15.32896 > 87.250.251.119.443: Flags [S], seq 3492652112, win 64240, options [mss 1460,sackOK,TS val 1504668466 ecr 0,nop,wscale 10], length 0
12:24:41.393301 IP 62.76.25.27.443 > 10.0.2.15.46440: Flags [P.], seq 1441:2881, ack 518, win 65535, length 1440
12:24:41.393380 IP 10.0.2.15.46440 > 62.76.25.27.443: Flags [.], ack 2881, win 63900, length 0
12:24:41.393482 IP 54.246.101.70.443 > 10.0.2.15.60082: Flags [P.], seq 4097:5288, ack 518, win 65535, length 1191
12:24:41.393502 IP 10.0.2.15.60082 > 54.246.101.70.443: Flags [.], ack 5288, win 63900, length 0
12:24:41.401705 IP 10.0.2.15.60082 > 54.246.101.70.443: Flags [P.], seq 518:644, ack 5288, win 63900, length 126
12:24:41.408756 IP 10.0.2.15.41326 > 79.171.117.17.443: Flags [.], ack 19872, win 63450, length 0
12:24:41.408982 IP 79.171.117.17.443 > 10.0.2.15.41326: Flags [P.], seq 19872:20863, ack 1597, win 65535, length 991
12:24:41.409015 IP 54.246.101.70.443 > 10.0.2.15.60082: Flags [.], ack 644, win 65535, length 0
12:24:41.409237 IP 10.0.2.15.41326 > 79.171.117.17.443: Flags [.], ack 20863, win 63450, length 0
12:24:41.410597 IP 62.76.25.27.443 > 10.0.2.15.46440: Flags [P.], seq 2881:2950, ack 518, win 65535, length 69
12:24:41.410642 IP 10.0.2.15.46440 > 62.76.25.27.443: Flags [.], ack 2950, win 63900, length 0
12:24:41.410670 IP 62.76.25.27.443 > 10.0.2.15.46438: Flags [P.], seq 1:2881, ack 518, win 65535, length 2880
12:24:41.410690 IP 10.0.2.15.46438 > 62.76.25.27.443: Flags [.], ack 2881, win 62480, length 0
12:24:41.410698 IP 93.158.134.118.443 > 10.0.2.15.54938: Flags [P.], seq 4817:5152, ack 1191, win 65535, length 335
12:24:41.410713 IP 10.0.2.15.54938 > 93.158.134.118.443: Flags [.], ack 5152, win 63450, length 0
12:24:41.411597 IP 10.0.2.15.46440 > 62.76.25.27.443: Flags [P.], seq 518:611, ack 2950, win 63900, length 93
12:24:41.412491 IP 62.76.25.27.443 > 10.0.2.15.46440: Flags [.], ack 611, win 65535, length 0
12:24:41.415826 IP 62.76.25.27.443 > 10.0.2.15.46438: Flags [P.], seq 2881:2951, ack 518, win 65535, length 70
12:24:41.415894 IP 10.0.2.15.46438 > 62.76.25.27.443: Flags [.], ack 2951, win 63900, length 0
12:24:41.420066 IP 10.0.2.15.46438 > 62.76.25.27.443: Flags [P.], seq 518:611, ack 2951, win 63900, length 93
